Channel ID,Video ID,Vidoe Title,Date Published,Description
,Za1IB5vbKAs,XAI66x | Elon Musk reveals new xAI Token on Lex Fridman,2024-10-22T10:29:46Z,"XAI66x is live on: crypto-xai.com This clip originated from the original interview series with Lex Fridman and Elon Musk, where ..."
,kLB2DpwZ0gc,🔥 xAI TOKEN PRESALE OFFICIAL!,2024-10-24T21:23:08Z,"Presale Official website:   https://project-xai.pro Welcome to the official YouTube channel of XAI-TOKEN coin, where we bring you ..."
,rSIzw9lBk5c,КРИПТОВАЛЮТА XAI | ОБЗОР И ПРОГНОЗ XAI TOKEN,2024-02-03T06:00:18Z,Cегодня поговорим о криптовалюте XAI . Так же сделаем обзор и прогноз XAI token Телеграм Канал: ...
,IcmSaaBKUKU,МОНЕТА XAI - ЭТО ВЫГОДНО,2024-05-12T13:49:45Z,МОНЕТА XAI - ЭТО ВЫГОДНО 00:00 - инвесторы XAI 01:52 - gamefi XAI 04:20 - мнение 06:06 - монета XAI - это выгодно ...
,uE4bRPydC0c,XAI Price Prediction. XAI Coin latests updates,2024-08-30T15:00:55Z,"XAI Price Prediction. XAI Coin latests updates DM me ""4LIGHT"" -10% code, for Indicators set - https://t.me/crypto4lightfounder ..."
,vAK-XnQ5B_Q,What Is XAI? | The $XAI Cryptocurrency Easy Explained,2024-04-01T16:54:47Z,"Hit Like, Share, and Subscribe for more videos about different assets in the market! The crypto exchange we buy this coin is ..."
,OUbBB649zWU,"Альткоины 2024. Новый гем в GameFI, криптовалюта XAI. Проект XAI прогноз и песрпективы.",2024-02-06T08:50:27Z,"Биржи, где покупаю и продаю криптовалюты: ▶︎ Bybit — https://partner.bybit.com/b/PavelP7 ▶︎ OKEX ..."
,ZI9HG2HEb_8,Why Xai Games is up 🤩 Xai Crypto Token Analysis,2024-02-24T14:15:02Z,Exclusive videos on our Telegram: https://t.me/bitcoinstrategychannel Buy winners early - join Premium: ...
,tRsxLLghL1k,Elon Musk on xAI: We will win | Lex Fridman Podcast,2024-08-05T12:00:59Z,Lex Fridman Podcast full episode: https://www.youtube.com/watch?v=Kbk9BiPhm7o Please support this podcast by checking out ...
,di2DGD21iWU,🔥 xAI TOKEN PRESALE OFFICIAL! 🌐https://project-xai.com   XAI50X XAI60X XAI95X XAI440P XAI14M XAI50P,2024-10-16T08:46:06Z,"Presale Official website:   https://project-xai.com Welcome to the official YouTube channel of XAI-TOKEN coin, where we bring ..."
,eIGVyzp8wlM,Manta Network и XAI | Что происходит с монетами??,2024-09-11T12:48:04Z,Manta Network и XAI | Что происходит с монетами? ﻿﻿ ▪️Почему токены так сильно свалились? ﻿﻿ ▪️Почему XAI может ...
,q0wpehWSDLI,XAI Price Prediction. Everything by plan,2024-07-03T15:00:50Z,"XAI Price Prediction. Everything by plan DM me ""4LIGHT"" -10% code, for Indicators set - https://t.me/crypto4lightfounder ..."
,NfkgR5FT9Pk,Xai Token Review 2023: The All-in-One Mobile App | Social + Ecommerce + Payments + Messaging!,2023-04-27T10:24:32Z,"Xai is an all-in-one platform that offers different services from Social Networking that connects other people, An e-commerce that ..."
,h-nSh9MFUsY,XAI token Reviewed - LOBSTR/STELLAR GEMS  -Elon Musk? AI?,2024-07-31T09:34:14Z,Stellar Gems reviewed - the XAI token - will it be the premier AI token for Elon Musk and the Xapp? Official Trustline: ...
,Iz5ke_ZudR8,🔥 xAI TOKEN PRESALE OFFICIAL! 🌐https://project-xai.com  XAI10X XAI60X XAI95X XAI440P XAI64P XAI50P,2024-10-16T09:01:44Z,"Presale Official website:   https://project-xai.com Welcome to the official YouTube channel of XAI-TOKEN coin, where we bring ..."
,i_U4s4Fau0c,НА ЭТОМ ТОКЕНЕ ТЫ СКОЛОТИШЬ СОСТОЯНИЕ В 2024 😮‍💨💰 РАЗБОР МОНЕТЫ XAI,2024-07-21T17:22:13Z,Этот токен дaст иксы. Разбор криптовалюты XAI. Эта крипта скоро вырастет. Криптавалюта на рост Телеграм канал ...
,MEgDG6B6uPc,Elon Musk&#39;s xAI is About To Take Over!,2024-05-29T21:00:20Z,Elon Musk's xAI is About To Take Over! Last video: The Tesla Semi Take Over Has Begun https://youtu.be/_iD7ytZkUMw ...
,XWrWJlUjEGg,XAI Price Prediction for the 2024-25 Bull Run,2024-02-03T05:00:27Z,Grow Your Crypto and Stablecoins Securely ▶️https://cryptonomy.finance/?r=34427 Cryptonomy backs the early-stage crypto ...
,5L46sWPx5uk,This Xai Crypto scam sucks!!,2024-07-15T07:52:08Z,"Yo fam! I recently took a loss to a crypto scam, losing $1100 AUD in just 48 hours. In the video, I share my experience and warn ..."
,oFNtSZoIqdM,XAI: Neuer Altcoin mit Potenzial? | Vorstellung,2024-02-11T11:08:08Z,Hier kaufen wir unsere Kryptos: Bitvavo - Mit die niedrigsten Gebühren auf dem Markt: [Nutze unseren Link und zahle KEINE ...
,SATiIs8MU_0,"НОВЫЕ МОНЕТЫ - БОЛЬШИЕ ИКСЫ! PYTH, XAI и ALT - почему покупаем в портфель?!",2024-02-11T16:48:37Z,"Подборка ТОП-3 новых монет бычьего рынка, купив которые прямо сейчас можно получить отличную прибыль в ..."
,6NlfNd2qa_w,Bahas Tuntas Token XAI - Fundamental Luar biasa 2024,2024-01-20T10:14:17Z,xaitoken #cryptoxai #crypto #cryptonews #cryptocurrency #bitcoin #binance #etherium #xai.
,h1eGcs6ZMyA,🔥 xAI TOKEN PRESALE OFFICIAL! 🌐 https://project-xai.com  XAI81P XAI61S XAI19F XAI60Z XAI49G XAI18Y,2024-10-25T14:37:19Z,"Presale Official website:   https://project-xai.com Welcome to the official YouTube channel of XAI-TOKEN coin, where we bring ..."
,oikwFAgrv1o,Missed Aethir &amp; XAI? This Crypto Project Will Be Bigger,2024-05-21T18:36:12Z,Join CARV Whitelist: https://node.carv.io/RT24FR Buy CARV NODE HERE (OPENS JUNE 3): verifier.carv.io CARV Website: ...
,jJScogwvIW8,WHY I WILL BUY XAI!🚨 | XAI Games Crypto Review,2024-01-09T15:00:49Z,"Binance Launchpool project XAI just launched, should you buy this coin? Join the Cilinix Premium for Amazing Value & Trade ..."
,MVaONagQ4-k,XAI - LANÇAMENTO NAS MAIORES CORRETORAS DO MUNDO - POTENCIAL DE 2.000%,2024-01-09T17:44:59Z,LINK PARA CADASTRO NA CORRETORA BINGX – VÁRIOS CUPONS https://bingx.com/partner/jpinvestimentos GRUPO DE ...
,UFfbZKKoeZc,XAI Price Prediction. Middle term updates,2024-06-05T08:19:41Z,"XAI Price Prediction. Middle term updates DM me ""4LIGHT"" -10% code, for Indicators set - https://t.me/crypto4lightfounder ..."
,Aseg6_2eB0I,Tokens to BUY NOW !!!,2023-01-28T10:26:38Z,"With Davincij15!!! @davincij15 #Bitcoin #crypto #shibainu #dogecoin DISCLAIMER The content, opinions and other information in ..."
,qH6BRlxPcxc,XAI GAMES 😱 BORA INVESTIR E GANHAR DINHEIRO JUNTOS NO NODE 💰,2024-01-18T14:32:04Z,"Xai Games é um projeto Layer 3 apoiada pela Layer 2 Arbitrum, o token foi lançado na Binance e tem investidores de peso."
,F3TWAD57N4s,Xai Token Analytics | Xai crypto | XAI coin New Altcoin,2024-07-12T11:56:48Z,Xai Token Analytics | Xai crypto | XAI coin New Altcoin ✔️ #xai I'm not a financial advisor. It's an educational Purpose Video.
,OTrUN_d42Rs,XAI Tokens &amp; Elon Musk: Hype or Reality?,2024-10-13T17:52:00Z,"""Curious about the rise of XAI tokens like XAI48H, XAI41T, and XAI59P? Wondering how Elon Musk's influence impacts these ..."
,wvPXTTCFXmI,WHY XAI COIN DEAD? 🥵| XAI PRICE PREDICTION | BEST WEB3 GAMING CRYPTO | CRYPTOCURRENCY | CRYPTO NEWS,2024-08-22T14:30:07Z,Official Telegram Channel: https://t.me/cryptoprolifeofficial #xaicoin #altcoins #solana #crypto #bitcoinnews #web3crypto ...
,taQQc7ikHu0,🔥 xAI TOKEN PRESALE OFFICIAL! 🌐 https://xaiofficial.com XAI81P XAI55W XAI14J CROGENX XAI61S,2024-10-24T09:44:08Z,"Presale Official website:   https://xaiofficial.com Welcome to the official YouTube channel of xAI-CRYPTO coin, where we bring ..."
,j-hGWepz-nA,XAI12H  - How to Buy xAI&#39;s New Crypto Token (2024),2024-10-14T17:00:31Z,XAI Presale : https://xaiofficial.com Discover the next big opportunity in cryptocurrency with XAI – a powerful altcoin set to ...
UC6ZPt5kjVeWOL6rzrYxXAqQ,,xAI-TOKEN,2024-10-01T09:27:17Z,"Welcome to the official YouTube channel of XAI-TOKEN coin, where we bring you the latest updates, insights, and in-depth ..."
,Ec5P6mSQ_rI,Why XAI Coin Price Dumping❓Xai Coin 71.9% Supply Unlock 9th July | Xai Tokenomics Explained #xai,2024-07-02T09:50:14Z,In This Video We Talking About XAI Crypto Coin Why Xai Price Dumping Main Reason Is Xai Supply Unlocking Event Also ...
,ZPDFK20RE40,How to Buy XAI Corp (XAI) Token Using ETH and UniSwap On Trust Wallet,2023-07-12T20:14:10Z,How to Buy XAI Corp (XAI) Token Using ETH and UniSwap On Trust Wallet OR MetaMask Wallet. I have only shared technical ...
,g325CgPRrZ4,🔥 xAI TOKEN PRESALE OFFICIAL! 🌐 https://project-xai.com  XAI46A XAI70B XAI34B XAI53N XAI92E XAI45U,2024-10-25T14:58:39Z,"Presale Official website:   https://project-xai.com Welcome to the official YouTube channel of XAI-TOKEN coin, where we bring ..."
,du0D2oviHIU,🔥 xAI TOKEN PRESALE OFFICIAL! 🌐 https://project-xai.com  XAI98Q XAI63U XAI82Z XAI24S XAI19Z XAI28U,2024-10-29T15:12:08Z,"Presale Official website:   https://project-xai.com Welcome to the official YouTube channel of XAI-TOKEN coin, where we bring ..."
,6G17zJRjuXA,XAI Coin Price Prediction 🔥 | No. 1 Layer 3 1000x Crypto Project,2024-09-15T12:13:40Z,"In this video, I have also shared each and everything about xai coin price prediction, xai price prediction, xai new update, and after ..."
,lHOnx_gGz-c,XAI76H XAI22M XAI51H 🔥 XAI TOKEN Presale Official website:🌐 https://project-xai.com XAI89M XAI37T,2024-10-09T13:43:11Z,"Presale Official website:   https://project-xai.com Welcome to the official YouTube channel of XAI-TOKEN coin, where we bring ..."
UCrAfBTdT_st-gLD-Q-dQT4A,,XAI TOKEN,2024-10-06T14:20:40Z,"Welcome to the official YouTube channel of XAI-TOKEN coin, where we bring you the latest updates, insights, and in-depth ..."
,chM852QaI9c,🚀𝐗𝐀𝐈 𝐂𝐎𝐈𝐍 𝐏𝐑𝐈𝐂𝐄 𝐏𝐑𝐄𝐃𝐈𝐂𝐓𝐈𝐎𝐍 𝐇𝐈𝐍𝐃𝐈 | 𝐗𝐀𝐈 𝐂𝐎𝐈𝐍 𝐋𝐀𝐓𝐄𝐒𝐓 𝐔𝐏𝐃𝐀𝐓𝐄,2024-01-31T12:10:09Z,XAI COIN PRICE PREDICTION HINDI | XAI COIN LATEST UPDATE IN THIS VIDEO I ...
,3wbVGnXqHlQ,XAI Coin Price Prediction! XAI Coin News Today,2024-07-19T09:30:00Z,Binance 7 to 10 Future Trading signals Join Telegram Telegram Free Signals Group Join Now https://t.me/abcryptovip Telegram ...
,MnLoHd5gx-Q,🔥NUEVA OPORTUNIDAD LAUNCHPOOL DE BINANCE ! XAI  TOKEN (XAI ) Como funciona?,2024-01-04T20:15:11Z,"APURATE y PARTICIPA DEL NUEVO LAUNCHPOOL DE BINANCE, SOLO DURA 4 DIAS ! HOLDEA FUSD, TUSD Y BNB PARA ..."
,-AblzG5kQO0,Elon Musk Menggemparkan Pasar Kripto dengan xAI! 🔥,2023-07-13T07:00:00Z,"Temukan kabar terbaru tentang Elon Musk dan perusahaan barunya, xAI, yang mempengaruhi kenaikan token kripto terkait ..."
,l5sqciumbjQ,COMO COMPRAR XAI TOKEN NA BINANCE (TUTORIAL),2024-01-07T00:21:00Z,"veja nesse vídeo como é fácil de comprar a criptomoeda xai pela binance, presta atenção e siga o passo a passo ..."
,qBvQPN8V3jI,XAI Coin Price Prediction! XAI Coin News Today,2024-07-18T10:30:14Z,Binance 7 to 10 Future Trading signals Join Telegram Telegram Free Signals Group Join Now https://t.me/abcryptovip Telegram ...
,IL4gksSxSQ8,XAI COIN PRICE PREDICTION $50 POSSIBLE? XAI CRYPTO FIRST LAYER-3 GAMING BLOCKCHAIN | XAI COIN BUYING,2024-05-03T08:03:31Z,IN THIS VIDEO DISCUSS ABOUT XAI CRYPTO FUTURE PREDICTION | XAI GAMING CRYPTO PROJECT | XAI LAYER-3 ...
,yTuCbQS_tQk,XAI Coin Price Prediction! XAI Coin News Today,2024-07-19T00:30:24Z,Binance 7 to 10 Future Trading signals Join Telegram Telegram Free Signals Group Join Now https://t.me/abcryptovip Telegram ...
,l5sqciumbjQ,COMO COMPRAR XAI TOKEN NA BINANCE (TUTORIAL),2024-01-07T00:21:00Z,"veja nesse vídeo como é fácil de comprar a criptomoeda xai pela binance, presta atenção e siga o passo a passo ..."
,wuJM0ZiY1Ig,"A review of the $XAI token, by Cake&amp;Crypto",2023-06-08T11:37:36Z,"An introduction and review of the $XAI token, reviewed by Cake&Crypto."
,zkeFVXtBEpI,🔥 xAI TOKEN PRESALE OFFICIAL! 🌐http://xai60x.com/ XAI50X XAI60X XAI95X XAI14M XAI50P,2024-10-16T10:43:01Z,"Presale Official website:   http://xai60x.com/ Welcome to the official YouTube channel of xAI-CRYPTO coin, where we bring you ..."
,styTgXKmP7g,XAI Presale: TOP 10 Altcoins 50x to 100x Potential -  XAI Token Official Release Confirmed!,2024-11-01T08:52:05Z,XAI Presale: presale.investxai.xyz Discover the next big crypto opportunity with XAI. Why XAI? First major coin for merchant ...
,rp4IyO4JCJs,🔥 xAI TOKEN PRESALE OFFICIAL! 🌐 https://xaiofficial.com XAI81P XAI14J XAI55W CROGENX XAI61S,2024-10-24T09:44:40Z,"Presale Official website:   https://xaiofficial.com Welcome to the official YouTube channel of xAI-CRYPTO coin, where we bring ..."
,mHwNoZ2C8wU,ANDREW TATE SAYS THIS ABOUT CRYPTO FUTURE  #shorts,2022-11-15T01:00:16Z,"shorts Andrew Tate talks about crypto - bitcoin, ethereum and the community scams that are happeing. Developers create ..."
,OtNk3FVCS9M,Xai Gaming Blockchain Capa 3 sobre Arbitrum 😎 Launpool Dinero del Aire 🤑,2024-01-04T18:00:09Z,Apoya mi contenido y recibe en Binance 20% descuento en comisiones https://bit.ly/BinanceJS20 Para links e información ...
,Vyimz35CRHE,Why Xai Games is up 🤩 Xai Crypto Token Analysis,2024-02-25T22:41:34Z,Watch the full video: https://www.youtube.com/c/BitcoinStrategy/videos #shorts Exclusive videos on our Telegram: ...
,mE8kS_hN0Os,Dự Án (XAI) Đã Thực Sự &quot;Ch*t&quot; Chưa - Cơ Hội Sống Còn Sau Airdrop?,2024-07-13T09:16:14Z,Đăng kí sàn CoinEx: https://www.coinex.com/register?refer_code=586g3 Tham gia nhóm tín hiệu trên Telegram: ...
,VJFUjA6U1uE,ELON MUSK 🔥 xAI TOKEN PRESALE OFFICIAL!🌐https://project-xai.com  XAI65F XAI550P XAI64F XAI94Z XAI16A,2024-10-31T17:00:34Z,"Presale Official website:   https://project-xai.com Welcome to the official YouTube channel of XAI-TOKEN coin, where we bring ..."
,krX6a3ODXzs,🔥 xAI TOKEN PRESALE OFFICIAL! 🌐 https://project-xai.com  XAI22M XAI51H XAI11M XAI13T XAI207K XAI18K,2024-10-11T10:33:10Z,"Presale Official website:   https://project-xai.com Welcome to the official YouTube channel of XAI-TOKEN coin, where we bring ..."
,MuaQW4--Z-I,XAI Prediction 01/JUL XAI COIN Price News Today Crypto Technical Analysis Update Price Now,2024-07-01T21:06:21Z,THE BEST EXCHANGE FOR TRADING : https://bit.ly/100Bitget NEW TELEGRAM : https://t.me/Officialcryptoinfos Price News ...
,2EbjYNzx3yg,Searching for a 100x Altcoin? Discover the Potential of XAI Token Presale,2024-10-26T22:52:35Z,Searching for a 100x Altcoin? Discover the Potential of XAI Token Presale XAI70B Presale: https://presale.investxai.xyz Discover ...
,JZMCvVmzYgk,-E. MUSK 🔥 xAI TOKEN PRESALE OFFICIAL! 🌐https://project-xai.com  XAI11N XAI52K XAI88N XAI90G XAI61R,2024-10-30T18:56:08Z,"Presale Official website:   https://project-xai.com Welcome to the official YouTube channel of XAI-TOKEN coin, where we bring ..."
,YhOTseaGjQQ,🔥 xAI TOKEN PRESALE OFFICIAL! 🌐https://project-xai.com  XAI94Z xAI82Y XAI58W XAI25Y XAI79W XAI16A,2024-10-31T17:05:02Z,"Presale Official website:   https://project-xai.com Welcome to the official YouTube channel of XAI-TOKEN coin, where we bring ..."
,O2MuYnnV8vw,XAI51G 🔥 xAI TOKEN PRESALE OFFICIAL! 🌐 https://project-xai.com  XAI81P XAI14J XAI89S XAI55W XAI550P,2024-10-24T09:12:22Z,"Presale Official website:   https://project-xai.com Welcome to the official YouTube channel of XAI-TOKEN coin, where we bring ..."
,gTGFqX8HLvU,CRYPTO TOKEN UNLOCK TRUTH | XAI 71.59% UNLOCK | ARBITRUM ECOSYSTEM | XAI GAMING | BITCOIN | LAYER3,2024-07-03T04:34:05Z,BingX - BingX - https://bingx.pro/partner/Knockknock CRYPTO TOKEN UNLOCK TRUTH | XAI 71.59% UNLOCK | ARBITRUM ...
,PtLC5fJNSm8,"Forget GALA Games, Invest in XAI crypto layer 3 &amp; make $$$.  Here&#39;s Why?",2024-01-10T06:21:59Z,XAI crypto aims to simplify blockchain for gaming industry. Its Layer 3 by Arbitrum chain with XAI token that challenges the GALA ...
,UDbscjjtDrA,🔥 xAI TOKEN PRESALE OFFICIAL!🔥,2024-10-31T20:15:19Z,XAI Presale: https://presale.investxai.xyz Discover the Next Big Opportunity in Cryptocurrency with XAI Introduction: XAI is an ...
,yD1rhA0EENM,🔥 xAI TOKEN PRESALE OFFICIAL! 🌐https://project-xai.com  XAI46V XAI34U XAI22T  XAI42O XAI28N XAI16A,2024-10-31T17:11:30Z,"Presale Official website:   https://project-xai.com #XAI16A Welcome to the official YouTube channel of XAI-TOKEN coin, where ..."
,b1-1yzCcc9s,Xai token,2023-08-09T01:19:00Z,
,Q4lGU7I-MTQ,Alemio Network 🔥 xAI TOKEN PRESALE OFFICIAL! 🌐https://xaiofficial.com XAI11N XAI95Z XAI41V XAI38C,2024-10-31T09:56:12Z,"Presale Official website:   https://xaiofficial.com Welcome to the official YouTube channel of XAI-TOKEN coin, where we bring you ..."
,sMZWeWtZRcg,LAYER 3 COINS XAI PRICE PREDICTION | XAI COIN | ARBITRUM ECOSYSTEM | L3 COINS | BITCOIN | CRYPTO,2024-05-04T14:59:19Z,BingX - BingX - https://bingx.pro/partner/Knockknock Mexc - https://www.mexc.com/register?inviteCode=1wXBH LAYER 3 COINS ...
,1xyo3yXvWKU,XAI51G 🔥 xAI TOKEN PRESALE OFFICIAL! 🌐 https://project-xai.com  XAI74Q XAI73N XAI31i XAI15A XAI45U,2024-10-25T15:02:23Z,"Presale Official website:   https://project-xai.com Welcome to the official YouTube channel of XAI-TOKEN coin, where we bring ..."
,yp1Is6y9Te8,"Elon Musk &quot;I love Dogecoin, but DON&#39;T buy it!&quot;",2023-05-25T16:17:27Z,"Elon Musk talks about SpaceX, Twitter, Presidential Candidates, AI, China, getting to mars, Succession, Tesla, OpenAI, ChatGPT, ..."
,WhndnPKQAh4,🔥 xAI TOKEN PRESALE OFFICIAL! 🌐 https://project-xai.com  XAI42E XAI51D XAI59B XAI78A XAI96Y XAI14W,2024-10-26T11:37:11Z,"Presale Official website:   https://project-xai.com Welcome to the official YouTube channel of XAI-TOKEN coin, where we bring ..."
,lYgjdjo3Xns,XAI COIN CHART PATTERNS SIGNAL MAJOR MOVES AHEAD! XAI COIN PRICE MOVEMENTS: CHART INSIGHTS !,2024-09-22T19:28:47Z,Join Our Patreon for Exclusive Long-Term Trade Signals! Get expert analysis and proven strategies to boost your crypto ...
,ZILyEhJff4M,ELON MUSK 🔥 xAI TOKEN PRESALE OFFICIAL!🌐https://project-xai.com  XAI4V XAI550P XAI64F XAI16A XAI86V,2024-11-01T08:53:20Z,"Presale Official website:   https://project-xai.com Welcome to the official YouTube channel of XAI-TOKEN coin, where we bring ..."
,ZiW2Llw4GBg,Xai Token Price Prediction | Xai token price | Xai coin price prediction,2024-10-18T06:10:51Z,binancelaunchpool #binance #launchpool #xai #xaitoken #xaitokenprice #xaitokenpriceprediction #xaicoin #xaiairdrop #xaicoin ...
,5SSrdJXK63I,XAI AKAN MENJADI RAJA CRYPTO GAME ?,2024-01-13T12:30:10Z,Selamat Datang di Channel Pace Crypto ! Email Bisnis : PaceCryptoYT@proton.me Support dan Apresiasi Konten Saya Saweria ...
,lLyzXO1Ml0o,🔴What is XAI Games?🔴XAI Coin News Today 2024🔴XAI Token Analiz,2024-07-05T14:15:03Z,"XAI Coin Overview General Information XAI Coin: XAI Coin is a cryptocurrency that may be associated with various platforms, ..."
,k4g4iX7b_zc,XAI GAMES - Át chủ bài hệ Arbitrum | Minhtuan.hc,2024-01-07T13:04:10Z,ƯU ĐÃI THAM GIA KÊNH PRIVATE CỦA HC KHI ĐĂNG KÝ LINK SÀN  : Bybit: http://hulkcrypto.com/go/bybit (code ref: 32672) ...
,8E6uFOP9Ed8,Xai Token Price Prediction | Xai token price | Xai coin price prediction,2024-10-03T09:51:13Z,binancelaunchpool #binance #launchpool #xai #xaitoken #xaitokenprice #xaitokenpriceprediction #xaicoin #xaiairdrop #xaicoin ...
,iKJz8gS_0aw,🔥 xAI TOKEN PRESALE OFFICIAL! 🌐 XAI44E XAI53D XAI62C XAI51B XAI40A,2024-10-31T23:16:26Z,"Presale Official website: https://xaiofficial.com Welcome to the official YouTube channel of XAI-TOKEN coin, where we bring you ..."
,ngdqk51NSgU,XAI51G 🔥 xAI TOKEN PRESALE OFFICIAL! 🌐XAI81P XAI61S XAI60Z XAI49G XAI18Y,2024-10-30T08:05:52Z,XAI51G Presale: https://xaiofficial.comDiscover the next big opportunity in cryptocurrency with XAI51G – a powerful altcoin set to ...
,doc1K5-dJd8,XAI Coin Price Prediction! XAI News Today,2024-01-18T19:45:01Z,Binance 7 to 10 Future Trading signals Join Telegram Telegram Free Signals Group Join Now https://t.me/abcryptovip Telegram ...
,tkUw5m7NjhI,XAI51G 🔥 xAI TOKEN PRESALE OFFICIAL! 🌐 https://project-xai.com  XAI81P XAI61S XAI60Z XAI49G XAI18Y,2024-10-25T09:37:59Z,"Presale Official website:   https://project-xai.com Welcome to the official YouTube channel of XAI-TOKEN coin, where we bring ..."
,6XYpa4JsWMY,Ankr Talking To Elon Musk?  xAI Gigafactory,2024-06-02T19:58:08Z,ankr #neura #elon Are Ankr and Elon in talks? Are they working on a project related to AI? Let's get started. I am not an economist ...
,u61mUAmcwzM,XAI Vs BEAM. Why I&#39;m Bullish &amp; Price Prediction,2024-01-16T17:26:32Z,More than $51K in rewards if you use my links. 🅱️Bybit:➡️ https://bit.ly/3y2wOgg 🅾️OKX: ➡️ https://bit.ly/3zKDYcO Pump ...
,UboXDH-KoUc,XAI Token Presale - GET READY FOR THIS 100X ALTCOIN,2024-10-29T17:15:03Z,XAI Token Presale - GET READY FOR THIS 100X ALTCOIN XAI Presale: https://presale.investxai.xyz Discover the next big ...
,CqHlIhQifZg,ASKING DUBAI MILLIONAIRES HOW MANY BITCOIN THEY OWN..,2021-09-21T19:46:56Z,
,yVg6I29R0XA,Is XAI (X) Token Legit or Scam ??,2023-07-26T11:45:41Z,"In this video, I am going to share that XAI (X) Token is legit or a scam. I have made videos based on online data, I am not a ..."
,Y1xb65NpWsU,🔥 xAI TOKEN PRESALE OFFICIAL! 🌐https://project-xai.com  XAI203K XAI57H XAI11M XAI13T XAI207K XAI18K,2024-10-12T13:13:53Z,"Presale Official website:   https://project-xai.com Welcome to the official YouTube channel of XAI-TOKEN coin, where we bring ..."
,m3THuqa0MZ8,XAI Crypto Coin Price Analysis And Prediction,2024-08-16T18:01:06Z,"You can buy XAI on Binance, below is the link: https://www.binance.com/?ref=11256882 For best trading signals join as a Patreon ..."
,HaGpi3ozyUs,XAI87NET 🔥 xAI TOKEN PRESALE OFFICIAL! 🌐 https://project-xai.com XAI22M XAI51H XAI11M XAI57H,2024-10-11T08:12:09Z,"Presale Official website:   https://project-xai.com Welcome to the official YouTube channel of XAI-TOKEN coin, where we bring ..."
,rbeptK-NQhY,Xai Layer 3: Next-Gen Gaming Token! #crypto #news (Short),2023-10-07T17:00:36Z,Check my - Step by Step HERE: https://www.cryptocurrencystate.net/airdrop// Check my Subscriptions to my Discord and my ...
,jsRVEIRMyzY,XAI Token Layer 3 Gaming Project | 100X pump 🚀 | New Coin on Binance Launchpool |,2024-01-08T12:33:23Z,XAI Token Layer 3 Gaming Project | 100X pump | New Coin on Binance Launchpool | #xai_token #binancelaunchpool ...
,umr_bivAH_o,Phân tích XAI_GAMES Layer 3 đầu tiên do team ARBITRUM phát triển XAI token có X khủng ?,2024-01-04T12:30:09Z,Donate:USDT-Bep20:0x4f961c719fec96ede6dd9a8f112d8af8730f8281 Link đăng ký các sàn giao dịch uy tín nhận Bonus và ...
,anGJ18AH9Lo,🔥 xAI TOKEN PRESALE OFFICIAL! 🌐 https://xaiofficial.com XAI98Q XAI63U XAI82Z XAI24S XAI19Z XAI20H,2024-10-30T02:08:58Z,"Presale Official website:   https://xaiofficial.com Welcome to the official YouTube channel of XAI-CRYPTO coin, where we bring ..."
,jdwbKwS8Nto,🔥 xAI TOKEN PRESALE OFFICIAL! 🌐https://project-xai.com  XAI86V XAI43F XAI43F XAI86V XAI4V XAI64F,2024-11-01T08:56:25Z,"Presale Official website:   https://project-xai.com Welcome to the official YouTube channel of XAI-TOKEN coin, where we bring ..."
,HKtad-wjNEo,🔥 xAI TOKEN PRESALE OFFICIAL! 🌐 XAI48O XAI41G XAI43K XAI91B XAI67i XAI55W XAI20S XAI16Z,2024-10-30T11:01:31Z,"Presale Official website:   https://xai-official.web.app/ Welcome to the official YouTube channel of XAI-TOKEN coin, where we ..."
,OPlGn7-bwSk,🔥 xAI TOKEN PRESALE OFFICIAL! 🌐https://project-xai.com  XAI86V XAI72G XAI64R XAI72T XAI4W XAI4V,2024-11-01T09:01:17Z,"Presale Official website:   https://project-xai.com Welcome to the official YouTube channel of XAI-TOKEN coin, where we bring ..."
,K-BFuM-Bgxk,XAI Crypto Coin Price Analysis And Prediction,2024-08-03T19:00:03Z,"You can buy XAI on Binance, below is the link: https://www.binance.com/?ref=11256882 For best trading signals join as a Patreon ..."
,1cm8DhELnNg,3 SECRET CRYPTO TOKENS THAT CAN 10x | PIXEL PRQ XAI | Crypto Market GEMS,2024-03-14T05:00:00Z,If you have signed up to Bybit using my link join our Jargon Insider channel here: https://t.me/jargonsig_bot (You can find UID in ...
,GXLYj0oWcEg,XAI19P coin How to Buy xAI New Crypto Token presale (2024).,2024-10-13T00:11:55Z,XAI19P Presale : https://xaiofficiai.tech/presale/ Uncover the next significant opportunity in the cryptocurrency market with XAI19P ...
,Kvc4yoHusTQ,Xai Token review | XAI up +1200% last 24 hours🤯🤯,2023-07-27T09:09:19Z,Xai Token review | XAI up +1200% last 24 hours    In this XAI token review I will share what xai really is enjoy. Best ...
,2EDgwsMiGPE,Xai (XAI) Token is a Legit or Scam | Is XAI token Legit or Scam ?,2024-01-24T22:30:23Z,In this video I am going to share with you Xai (XAI) token is a legit or Scam. this video is only for Education purpose not financial ...
,lUyttBjrUIM,Short Squeeze and XAI Token Unlock??,2024-07-09T18:35:07Z,
,jjFTsXRu01c,🔥 xAI TOKEN PRESALE OFFICIAL! 🌐https://project-xai.com  XAI203K XAI57H XAI11M XAI13T XAI207K XAI18K,2024-10-12T13:17:14Z,"Presale Official website:   https://project-xai.com Welcome to the official YouTube channel of XAI-TOKEN coin, where we bring ..."
,kY_rhRVXxhU,ELON MUSK COIN?! XAI $XAI #shorts #video #viral #bitcoin #cryptocurrency #crypto #xrp #money,2024-07-02T19:28:04Z,
