Channel ID,Video ID,Vidoe Title,Date Published,Description
,wAtAz4shIgg,₹40 का Crypto Coin बन सकता है ₹1000 का 2025 में ! Best Crypto to Buy Now #crypto #altcoins #shorts,2024-05-05T13:15:03Z,bestcrypto #topaltcoins #shibainucoin #bitcoin #cryptocurrency #youtubeshorts.
,rfkEXLgH5Uk,XAI76H 🔥 XaI TOKEN Presale Official 🌐 https://project-xai.com XAI29K XAI60M XAI55P XAI76H XAI94X,2024-10-09T08:02:20Z,"Presale Official website:   https://project-xai.com Welcome to the official YouTube channel of XAI-TOKEN coin, where we bring ..."
,p9woIudNEJA,$100 Claim free XAI Token | Xai token airdrop | Binance Lanchpool New Project | Xai token listing,2024-01-06T13:41:01Z,binancelaunchpool #binance #launchpool #xai #xaitoken #xaiairdrop #xaicoin #binancelisting #newcoin If You are New ...
,g-y4XLdg9S0,XAI COIN CHART EVALUATION: FUTURE OUTLOOK! XAI COIN PRICE MOVEMENTS: CHART INSIGHTS !,2024-07-30T07:54:01Z,TO SUPPORT OUR CHANNEL YOU CAN CONTRIBUTE IN THE BELOW MENTIONED DETAILS or JOIN THE MEMBERSHIP ...
,T8re6kRRaNg,XAI54W - BUY ALTCOIN RIGHT NOW OR REMAIN POOR FOREVER! XAI54W,2024-09-03T05:34:48Z,investing #crypto #altcoins GET UP TO 200% BONUS NOW!! https://xai-token.app/presale/ Seizing the Opportunity: XAI54W ...
,Of6AF1PyKxw,XAI CRYPTO COIN PRICE PREDICATION,2024-03-14T16:19:50Z,My XAI Price Prediction for the Upcoming Crypto Bull Run is finally revealed! Trade Crypto via MEXC  .
,LMw8AfP7fVM,Binance launchpad | Binance Airdrop | New listings on XAI Token | Crypto box codes,2024-01-06T11:44:33Z,binance #airdrop #ai $1000 Claim Free XAI Token | Sleepless AI Binance launchpool 2024 | Free Airdrop Binance 2024 Website ...
,34UpJD7eWI4,$100 Claim Free XAI Token 🚀 - XAI Binance launchpool 2024 🤑 | Free Airdrop Binance 2024 😁,2024-01-04T16:01:53Z,Claim Free XAI Token - XAI Binance launchpool 2024 | Free Airdrop Binance 2024 Binance App Link ...
,uQ-l7XwtfYc,So REICH werden 2024?! 🤑 JETZT kaufen?? XAI Games &amp; NODE erklärt! (Web3 &amp; Crypto Gaming Deutsch),2024-01-19T13:53:23Z,Explodiert XAI 2024 und wird Xai Games eines der Top Krypto Gaming Projekte? In diesem Video erklären wir dir was Xai Games ...
,mE8HK5MLh9g,XAI Prediction 15/OCT XAI COIN Price News Today Crypto Technical Analysis Update Price Now,2024-10-15T14:23:49Z,THE BEST EXCHANGE FOR TRADING : https://bit.ly/100Bitget NEW TELEGRAM : https://t.me/Officialcryptoinfos Price News ...
,uEFoJzjm7Dc,$50 USDT🔥 Profit Xai Token Airdrop || Xai Coin Airdrop From Bybit || Bybit Exchange New Offer ||,2024-03-12T15:24:41Z,Today Link: https://t.me/onlinesupport24bd/6964 ✓   Business Contact       Contact to promote any earning ...
,lkdizTxKpmo,XAI Prediction 22/AUG XAI COIN Price News Today Crypto Technical Analysis Update Price Now,2024-08-22T16:29:36Z,THE BEST EXCHANGE FOR TRADING : https://bit.ly/100Bitget NEW TELEGRAM : https://t.me/Officialcryptoinfos Price News ...
,xG-fREo08zc,&quot;🚀 Binance New Listing  XAI Token Launching on Binance Launchpool | XAI Gaming Crypto Unleashed! 💻🎮&quot;,2024-01-05T05:24:53Z,"Exciting news for the crypto gaming community! Binance is set to list the XAI Token, an innovative gaming crypto, on the Binance ..."
,zl55Izj5GTs,XAI52E - How to Buy Elon Musk&#39;s New Crypto Token (2024),2024-10-30T15:37:05Z,"Get The Hottest Crypto Deals https://xaiofficial.com Unlock the potential of XAI52E, the game-changing cryptocurrency with the ..."
,X8d-qr2oTLQ,XAI76G - How to Buy Elon Musk&#39;s New Crypto Token (2024),2024-10-30T15:41:48Z,"Get The Hottest Crypto Deals https://xaiofficial.com Unlock the potential of XAI76G, the game-changing cryptocurrency with the ..."
,4lD0smeWIhM,Don&#39;t Miss XAI Launchpool ❌ 2$ Sleepless AI Token Price Listed On Binance,2024-01-04T10:40:30Z,XAI Launchpool Update : https://youtu.be/wu4yggvqDX0 Introducing Sleepless AI (AI) on Binance Launchpool! Farm AI by Staking ...
,xl6JPkBdcSE,"Xai (XAI) Airdrop BLOCKCHAIN GAMINGDEVELOPED FOR MASS ADOPTION Max Token Supply2,500,000,000",2024-01-07T14:48:36Z,"Xai (XAI) Airdrop BLOCKCHAIN GAMING DEVELOPED FOR MASS ADOPTION Max Token Supply2,500000000 Max Token ..."
,B1mZIWzw64I,Legendary Project Of Legendary Ecosystem | This Project Better Then Matic | Next 50X To 100X,2024-08-21T04:45:00Z,Legendary Project Of Legendary Ecosystem || XAI Token Future Any Questions Join Our Telegram Group = 1.
,8NhihWMLU0M,I Got $100 FREE Airdrop Confirmed XAI BINANCE Listing Token🚀 Tamil,2024-01-05T11:11:40Z,BINANCE NEW Launchpool | BINANCE NEW Listing #binanceLaunchpool #freeairdrop #freecrypto Topic Covered: binance ...
,xtZYpH3boqs,XAI41V - How to Buy Elon Musk&#39;s New Crypto Token (2024),2024-10-30T15:31:13Z,"Get The Hottest Crypto Deals https://xaiofficial.com Unlock the potential of XAI41V, the game-changing cryptocurrency with the ..."
,useThatCKBg,XAI16A - How to Buy Elon Musk&#39;s New Crypto Token (2024),2024-10-30T17:07:41Z,"Get The Hottest Crypto Deals https://xaiofficial.com Unlock the potential of XAI16A, the game-changing cryptocurrency with the ..."
,T0zFL5hLfwg,XAI95Z - How to Buy Elon Musk&#39;s New Crypto Token (2024),2024-10-30T17:06:11Z,"Get The Hottest Crypto Deals https://xaiofficial.com Unlock the potential of XAI95Z, the game-changing cryptocurrency with the ..."
,x0kNgk1frz4,[ Bybit &amp; XAI Event 30 XAI Token Per User ]_ 45$ Xai Token পাবেন। সম্পূর্ণ ভিডিও টা দেখে জয়েন করুন 🤑,2024-03-16T04:57:35Z,আমাদের চ্যানেলটিকে যারা এখনো Subcribe করেন নাই প্লিজ চ্যানেলটি subcribe ...
,AgxjFniKkjw,XAI COIN CHART PATTERNS SIGNAL MAJOR MOVES AHEAD! XAI COIN PRICE MOVEMENTS: CHART INSIGHTS !,2024-10-08T17:24:52Z,JOIN OUR PATREON AND YOUTUBE MEMBERSHIP PROGRAM TO SUPPORT OUR CHANNEL! YOUR CONTRIBUTION ...
,jI-GXprnYg4,Sleepless Ai Airdrop Token Claim || Xai Token Binance Airdrop || Xai &amp; Ai Token Price Prediction ||,2024-01-03T16:57:55Z,About that Video: ============== Sleepless Ai Airdrop Token Claim || Xai Token Binance Airdrop || Xai & Ai Token Price ...
,IH-GoT1bEj0,XAI57G coin How to Buy xAI New Crypto Token presale (2024).,2024-10-11T21:04:05Z,XAI57G Presale : https://xaiofficiai.tech/presale/ Uncover the next significant opportunity in the cryptocurrency market with XAI57G ...
,B5slKoglwtk,XAI33K - HOW TO BUY Elon Musk&#39;S XAI33K  (Full guide 2024),2024-10-31T18:15:36Z,XAI33K Presale : https://xaiofficial.com Discover the next big opportunity in cryptocurrency with XAI33K – a powerful altcoin set to ...
,QZ033CsyrU4,TOKEN XAI REVERTE QUEDA E PODE SUBIR MUITO FORTE,2024-03-09T16:25:53Z,UM CURSO SOBRE DEFI COMPLETO FEITO POR MIN PARA VOCÊS COM EMPRESTIMOS GERENCIAMENTO DE RISCO E ...
,-D2yAeN4Nu8,XAI COİN NEREYE GİDECEK? ALANLAR NE YAPMALI?,2024-01-09T12:10:11Z,Abone olursanız videolardan direk haberiniz olur. Çok ciddi kazanç sağlayacağımız projeler paylaşacağım yakın zamanda.
,kqrkp84bljY,Farmea el nuevo token de CRYPTOUNICORNS en la red de XAI (Tutorial de migración y staking),2024-06-22T18:00:23Z,En este video te enseño a cambiar y migrar tus Rainbow Tokens por el nuevo token CRYPTOUNICORNS en la red de XAI.
,cWA_H7Iw9J8,XAI Prediction 15/JUL XAI COIN Price News Today Crypto Technical Analysis Update Price Now,2024-07-15T14:01:19Z,THE BEST EXCHANGE FOR TRADING : https://bit.ly/100Bitget NEW TELEGRAM : https://t.me/Officialcryptoinfos Price News ...
,bgsJt6OFrTo,XAI Prediction 31/AUG XAI COIN Price News Today Crypto Technical Analysis Update Price Now,2024-08-31T18:09:11Z,THE BEST EXCHANGE FOR TRADING : https://bit.ly/100Bitget NEW TELEGRAM : https://t.me/Officialcryptoinfos Price News ...
,Xqtppm_t9as,Binance Launchpool XAI GAMES nhận XAI token miễn phí và giá XAI bao nhiêu khi list sàn Binance ?,2024-01-04T00:00:09Z,Link đăng ký sàn giao dịch nhận bonus và giảm phí giao dịch: Sàn Binance giảm ...
,gPVzWL-AJWA,"XAI Vanguard Genesis (P4) - Deploy contract NFT, token trên XAI builder, Thirdweb / add liquidity",2024-06-28T13:28:26Z,0:01 Intro 2:12 Mint XAI Odyssey Dev quest token 5:35 Deploy & Configure your Own NFT Drop Contract trên Thirdweb 8:36 ...
,wq7oSHVEIac,Earn $42 Airdrop | Xai Token Airdrop on Bybit | 30 Xai Tokens For Each,2024-03-14T11:26:13Z,"In this video, I will tell you how to participate in the Xai token Airdrop Campaign on bybit. Follow all the steps and get a chance to ..."
,m6WjGYsCMAg,"CLAIM 1,000 ($5000) XAI TOKEN on Trust Wallet",2024-01-14T13:23:41Z,CLAIM 1000 ($5000) XAI TOKEN on Trust Wallet Airdrop Link: https://t.me/hackmindcryptoairdropp/2671 CREATE BINÁNCE ...
,mxVra0_-gPg,Bybit New Event 1025000 Xai Token Airdrop || Minimum Profit 40$-50$ || Bybit New Offer Today,2024-03-15T13:30:32Z,Bybit New Event 1025000 Xai Token Airdrop || Minimum Profit 40$-50$ || Bybit New Offer Today ✓✓Todays Offer link: ...
,Aa-KjkPtt_M,I’m BUYING These ALTCOINS Right Now! [MASSIVE CRYPTO BREAKOUT],2024-05-20T07:37:08Z,"Altcoins are breaking out and we have bullish confirmation. In today's episode of Crypto Banter, Kyledoops shares his top Altcoin ..."
,yBnC4Pyc7t0,XAI आने वाला है बड़ा PUMP | XAI COIN PRICE PREDICTION | XAI COIN UPDATE 3 JUNE 2024,2024-06-03T10:44:15Z,"Disclaimer - Cryptocurrency trading on Exchanges and investment, mining & ICO or IEO investment is a risky business, We do not ..."
,Dx6lR232MWQ,XAI Presale: This will be The BIGGEST Crypto Run EVER Starts NOW!,2024-10-29T16:50:26Z,XAI Presale: This will be The BIGGEST Crypto Run EVER Starts NOW! XAI Presale: https://presale.investxai.xyz Discover the next ...
,nW9lBU_sD0A,XAI33K 100x POTENTIAL AFTER ETH ETF APPROVED ?,2024-10-31T18:15:51Z,XAI33K Presale : https://xaiofficial.com Discover the next big opportunity in cryptocurrency with XAI33K – a powerful altcoin set to ...
,sSzTe4cK_Eg,"45$+ Profit Confirm || Bybit New Offer || 30 Xai Token For 30,000 Users",2024-03-11T15:51:52Z,Don't Skip this video ❌❌ Title: 45$+ Profit Confirm || Bybit New Offer || 30 Xai For 30000 Users আজকের অফার লিংক: ...
,sCkhlSp23t0,30.667 kişinin 45$ kazanacağı Bybit Borsası Xai token etkinliği ! ! !,2024-03-11T22:38:21Z,1) Bybit borsasına kayıt ol ve kimlik doğrulamasını tamamla. Bybit kayıt linki: https://www.bybit.com/invite?ref=DY4OY 2) Aşağıdaki ...
,5rN0_vvHfzE,XAI Prediction 22/SEP XAI COIN Price News Today - Crypto Technical Analysis Update Price,2024-09-22T15:28:27Z,
,ihYQds33AlE,XAI49A - How to Buy Elon Musk&#39;s New Crypto Token (2024),2024-10-31T04:43:04Z,"Get The Hottest Crypto Deals https://xaiofficial.com Unlock the potential of XAI49A, the game-changing cryptocurrency with the ..."
,JyMiGqKrzzI,XAI89H - How to Buy Elon Musk&#39;s New Crypto Token (2024),2024-10-31T03:54:26Z,"Get The Hottest Crypto Deals https://xaiofficial.com Unlock the potential of XAI89H, the game-changing cryptocurrency with the ..."
,dkN78KVc5Ko,XAI24K - How to Buy Elon Musk&#39;s New Crypto Token (2024),2024-10-31T00:56:55Z,"Get The Hottest Crypto Deals https://xaiofficial.com Unlock the potential of XAI24K, the game-changing cryptocurrency with the ..."
,08ylZItAf4E,XAI41D - How to Buy Elon Musk&#39;s New Crypto Token (2024),2024-10-31T03:29:39Z,"Get The Hottest Crypto Deals https://xaiofficial.com Unlock the potential of XAI41D, the game-changing cryptocurrency with the ..."
,71sA_1rWMxM,XAI65F - How to Buy Elon Musk&#39;s New Crypto Token (2024),2024-10-31T03:47:12Z,"Get The Hottest Crypto Deals https://xaiofficial.com Unlock the potential of XAI65F, the game-changing cryptocurrency with the ..."
,,The Disruptive Technologies Podcast,2023-10-29T22:07:40Z,"Welcome to The Disruptive Technologies Podcast, for individuals who want to stay informed about the cutting-edge developments ..."
,sqDe0LatDlc,XAI34U - How to Buy Elon Musk&#39;s New Crypto Token (2024),2024-10-31T07:46:09Z,"Get The Hottest Crypto Deals https://xaiofficial.com Unlock the potential of XAI34U, the game-changing cryptocurrency with the ..."
,rf5GtokOcJI,XAI11S - How to Buy Elon Musk&#39;s New Crypto Token (2024),2024-10-30T16:21:10Z,"Get The Hottest Crypto Deals https://xaiofficial.com Unlock the potential of XAI11S, the game-changing cryptocurrency with the ..."
,GXaTZx5H9A8,XAI22T - How to Buy Elon Musk&#39;s New Crypto Token (2024),2024-10-31T07:43:59Z,"Get The Hottest Crypto Deals https://xaiofficial.com Unlock the potential of XAI22T, the game-changing cryptocurrency with the ..."
,M5epxCROVjU,XAI12J - How to Buy Elon Musk&#39;s New Crypto Token (2024),2024-10-30T17:15:11Z,"Get The Hottest Crypto Deals https://xaiofficial.com Unlock the potential of XAI12J, the game-changing cryptocurrency with the ..."
,2YiRu12QIzU,XAI25Y - How to Buy Elon Musk&#39;s New Crypto Token (2024),2024-10-31T04:29:01Z,"Get The Hottest Crypto Deals https://xaiofficial.com Unlock the potential of XAI25Y, the game-changing cryptocurrency with the ..."
,fCyLm85UTYg,XAI10I vs. Bitcoin: How XAI10I  Is Set to Dominate 2024 – Get Your XAI10I  Before It’s Too Late,2024-10-29T20:57:01Z,XAI10I Presale : https://xaiofficial.com Discover the next big opportunity in cryptocurrency with XAI10I – a powerful altcoin set to ...
,wk28WHkMfJk,XAI2V | XAI9X FINALLY Elon Musk TOKENS REVEALED! [ XAI2V | XAI9X ],2024-11-01T09:29:16Z,XAI2V | XAI9X Presale: https://xaiofficial.com Discover the next big opportunity in cryptocurrency with XAI2V | XAI9X – a powerful ...
,tilkL9lnEQs,XAI Presale: XRP Holders Are About To Be VERY RICH (Here&#39;s Why),2024-10-31T19:01:43Z,XAI Presale: XRP Holders Are About To Be VERY RICH (Here's Why) XAI Presale: https://presale.investxai.xyz Discover the Next ...
,K0rWxanfQSY,INDECISÃO NO BTC APÓS OS DADOS DE PAYROLLS | SEGURA OS 70K OU NÃO?,2024-11-01T12:02:08Z,INDECISÃO NO BTC APÓS OS DADOS DE PAYROLLS | SEGURA OS 70K OU NÃO? Corretoras que eu utilizo nos tutoriais: ...
,2EfBhNC_Zso,Maximize Your Efficiency and Cost-Savings with API Integration,2024-10-29T19:03:35Z,Discover how API integration can streamline your development process and enhance your natural language processing ...