Channel ID,Video ID,Vidoe Title,Date Published,Description
,5w-KtV8yzx8,Xai Token Price Prediction | Xai token price | Xai coin price prediction,2024-03-20T08:40:53Z,binancelaunchpool #binance #launchpool #xai #xaitoken #xaitokenprice #xaitokenpriceprediction #xaicoin #xaiairdrop #xaicoin ...
,mfItQRt08Lg,"Phân tích Altlayer (ALT), Sleepless AI (AI), XAI đồng coin nào đáng đầu tư trong 2024 | Sang LV",2024-02-22T11:30:07Z,Airdrop Sàn OKX: https://okx.com/vi/campaigns/airdrop-rush?channelid=28684048 Group thảo luận: https://t.me/coinlize MUA ...
,FAHCRujzC8U,Cosmos ( ATOM ) | Invest €150 | XAI Token,2024-01-12T10:00:10Z,In This Episode: I Invest €150 and Buy Cosmos ( ATOM ) | Put on the Locked Stacking on Binance for 120 Days. XAI Token.
,aBGyTAsgcU0,🔥 xAI TOKEN PRESALE OFFICIAL! 🌐https://project-xai.com  XAI203K XAI57H XAI11M XAI13T XAI207K XAI18K,2024-10-12T13:19:33Z,"Presale Official website:   https://project-xai.com Welcome to the official YouTube channel of XAI-TOKEN coin, where we bring ..."
,e9LEojaohnk,Siêu Airdrop Nhận Ngẫu Nhiên 30 XAI Token | Cộng Đồng Crypto,2024-03-13T05:26:30Z,Siêu Airdrop Nhận Ngẫu Nhiên 30 XAI Token Trên Sàn Bybit Link tham gia: https://t.me/phuc_binance/848 Link nhóm telegram ...
,osTc1LgJoMc,Xai Token Price Prediction | Xai token price | Xai coin price prediction,2024-07-22T04:27:06Z,binancelaunchpool #binance #launchpool #xai #xaitoken #xaitokenprice #xaitokenpriceprediction #xaicoin #xaiairdrop #xaicoin ...
,zr1CpibeuVY,$GROK xAI - GROK xAI TOKEN CRYPTO COIN ALTCOIN HOW TO BUY GROKxAI ELON MUSK NFT BSC ETH BNB ETHEREUM,2023-11-11T02:51:19Z,REFERRAL CODES MEXC REFERRAL CODE... https://www.mexc.com/register?inviteCode=mexc-1FHY2 CoinEX REFERRAL ...
,VaeA9CoQlhc,Unlock the Binance Crypto Launchpad Airdrop: Earn XAI Tokens,2024-01-07T06:22:09Z,"Unlock the Binance Crypto Launchpad Airdrop: Earn XAI Tokens How to Participate In this exciting video, we'll guide you through ..."
,TNNoOkQtAQ0,Xai Games ($XAI)  Airdrop 500$  XAI token,2024-02-21T07:49:43Z,Claim $500 in XAI GAMES (check the link in the comments)   Airdrop is part of our marketing strategies to promote our token to ...
,QZEYvTWmha4,$100 Claim FREE XAI Token 🚀 - XAI Binance launchpool 2024 🤑 || Free Airdrop Binance in  2024 😱 FREE,2024-01-05T10:32:14Z,Claim Free XAI Token - XAI Binance launchpool 2024 | Free Airdrop Binance 2023 #binance @free @TechieHome ...
,mCjdbwdkmPg,"Toplu Analiz (XAI,EDU,AITECH)",2024-03-15T19:05:32Z,"Hoş geldiniz Hiç bir ön gereksinim gerektirmeyen, yazılımcılık deneyimi gerektirmeyen, yılların deneyimlerini olası en basit hale ..."
,EDUeURkWoyQ,XAI Coin: Is Investing in XAI Token Still Worth it in 2024?,2024-01-15T15:27:01Z,xai coin* is a hot gaming platform. in this *Xai crypto* video I'll share why we might see a 15x Xai coin pump for the *Xai network* ...
,m4Dr5vSfaIY,XAI Crypto Coin Price Analysis And Prediction,2024-07-21T18:49:34Z,"You can buy XAI on Binance, below is the link: https://www.binance.com/?ref=11256882 For best trading signals join as a Patreon ..."
,4P3pjXrS9x4,Update Your Xai Node To Earn Xai Token Rewards: A Step-by-step Guide,2024-03-03T14:35:44Z,HOW TO RUN XAI NODE MANDATORY UPDATE TO RECEIVE THE XAI TOKEN REWARD KINZA - https://bit.ly/3T3ubqw AEVO- ...
,LNkWn-pm2dc,"Elon Musk&#39;s New xAI, What You Need To Know",2023-07-20T14:00:10Z,"Elon Musk recently announced the creation of a new AI company called X AI, aimed at developing a truth-seeking artificial general ..."
,eCeIfE8Sk0M,Xai Token Price Prediction | Xai token price | Xai coin price prediction,2024-05-23T11:40:00Z,binancelaunchpool #binance #launchpool #xai #xaitoken #xaitokenprice #xaitokenpriceprediction #xaicoin #xaiairdrop #xaicoin ...
,mWWKwppdMks,XAI TOKEN MAJOR PRICE PUMP! XAI CRYPTO PRICE PREDICTION &amp; ANALYSIS! XAI PRICE FORECAST 2024,2024-01-14T11:00:38Z,XAI TOKEN MAJOR PRICE PUMP! XAI CRYPTO PRICE PREDICTION & ANALYSIS! XAI PRICE FORECAST 2024 Welcome back ...
,TVTDxG-qy0g,🔥 xAI TOKEN PRESALE OFFICIAL! 🌐 XAI26R XAI41S XAI29R XAI17Q XAI83O XAI95P XAI71N,2024-11-01T02:54:32Z,XAI64F Presale: https://xaiofficial.com Discover the next big opportunity in cryptocurrency with XAI64F – a powerful altcoin set to ...
,a6OdB9WBva8,XAI TOKEN MAJOR PRICE UPDATE! XAI CRYPTO PRICE PREDICTION &amp; ANALYSIS! XAI PRICE FORECAST 2024,2024-01-17T23:00:00Z,XAI TOKEN MAJOR PRICE UPDATE! XAI CRYPTO PRICE PREDICTION & ANALYSIS! XAI PRICE FORECAST 2024 Welcome ...
,dbDJo99x5xU,🚀Token XAI será listado na Binance amanhã.,2024-01-08T23:52:15Z,Token XAI será listado na Binance amanhã dia 09/01 às 7 horas. #xai #binance #game #binancelaunchpool #draccrypto.
,gFifaqRD050,xai coin | next 10x crypto gaming coins to buy | xai price prediction | best crypto gaming projects,2024-01-25T10:44:38Z,"xai coin | next 10x crypto gaming coins to buy | xai price prediction | best crypto gaming projects In this video, we will discuss ..."
,zEHSQ_lZ6uk,🔥 XaI TOKEN Presale Official 🌐 https://project-xai.com  XAI89M  XAI24X XAI84D XAI94X XAI37T XAI24X,2024-10-08T17:03:16Z,"Presale Official website:   https://project-xai.com Welcome to the official YouTube channel of XAI-TOKEN coin, where we bring ..."
,YuJnlj5sNmI,🔥 XAI TOKEN Presale Official website:🌐https://project-xai.com  XAI10M XAI440P XAI95T XAI204K XAI47G,2024-10-07T11:50:08Z,"Presale Official website:   https://project-xai.com Welcome to the official YouTube channel of XAI-TOKEN coin, where we bring ..."
,LhICYvPZQME,BINANCE BEDAVA TOKEN DAĞITIYOR | XAI LAUNCHPOOL İNCELEMESİ,2024-01-03T18:01:19Z,Coin Mühendisi'ne hoşgeldiniz! Binance üzerinden tamamen ücretsiz token kazanabildiğimiz 43. Launchpool etkinliğinde sizlerle ...
,XaNF8v-s92c,XAI76H  🔥 XaI TOKEN Presale Official website:🌐 https://project-xai.com  XAI89M XAI30H XAI23T XAI24X,2024-10-08T07:59:56Z,"Presale Official website:   https://project-xai.com Welcome to the official YouTube channel of XAI-TOKEN coin, where we bring ..."
,d-YEioPHkCM,Xai Token Price Prediction | Xai token price | Xai coin price prediction,2024-07-07T05:36:26Z,binancelaunchpool #binance #launchpool #xai #xaitoken #xaitokenprice #xaitokenpriceprediction #xaicoin #xaiairdrop #xaicoin ...
,gASvQSjSvxY,TE ARREPENDRÁS DE NO COMPRAR MONEDAS XAI || ¡¡ESTA ES LA RAZÓN!!,2024-01-18T16:00:22Z,"En este video, hablé sobre el token XAI, XAI, la moneda XAI, la criptomoneda XAI, las noticias de monedas XAI, el precio de XAI, ..."
,YuJnlj5sNmI,🔥 XAI TOKEN Presale Official website:🌐https://project-xai.com  XAI10M XAI440P XAI95T XAI204K XAI47G,2024-10-07T11:50:08Z,"Presale Official website:   https://project-xai.com Welcome to the official YouTube channel of XAI-TOKEN coin, where we bring ..."
,slIriA-pfac,Big Names Are Backing This Gaming Coin That’s About To Explode!,2024-06-04T16:24:17Z,Are you ready for crypto gaming? ▻ Join the VIP Discord: https://whop.com/selectedinvestments/ ...
,aBGyTAsgcU0,🔥 xAI TOKEN PRESALE OFFICIAL! 🌐https://project-xai.com  XAI203K XAI57H XAI11M XAI13T XAI207K XAI18K,2024-10-12T13:19:33Z,"Presale Official website:   https://project-xai.com Welcome to the official YouTube channel of XAI-TOKEN coin, where we bring ..."
,e9LEojaohnk,Siêu Airdrop Nhận Ngẫu Nhiên 30 XAI Token | Cộng Đồng Crypto,2024-03-13T05:26:30Z,Siêu Airdrop Nhận Ngẫu Nhiên 30 XAI Token Trên Sàn Bybit Link tham gia: https://t.me/phuc_binance/848 Link nhóm telegram ...
,ULxo5KZJU4w,Binance will list XAI Token | Binance New Listing | XAI Gaming Crypto On Binance Launchpool,2024-01-03T10:50:45Z,In This Video Guys Binance will list XAI Token | Binance New Listing | XAI Gaming Blockchain Crypto On Binance Launchpool ...
,VaeA9CoQlhc,Unlock the Binance Crypto Launchpad Airdrop: Earn XAI Tokens,2024-01-07T06:22:09Z,"Unlock the Binance Crypto Launchpad Airdrop: Earn XAI Tokens How to Participate In this exciting video, we'll guide you through ..."
,TNNoOkQtAQ0,Xai Games ($XAI)  Airdrop 500$  XAI token,2024-02-21T07:49:43Z,Claim $500 in XAI GAMES (check the link in the comments)   Airdrop is part of our marketing strategies to promote our token to ...
,EhxuE0yVkgw,BINANCE Top 7 Picks! 2024-25 Bull Run Projects List 📈,2024-04-18T04:38:41Z,BINANCE Top 7 Picks! 2024-25 Bull Run Projects List Manta: https://youtu.be/gW97WzBTbSU?si=3KXwf3JtR40H30dQ Xai: ...
,QZEYvTWmha4,$100 Claim FREE XAI Token 🚀 - XAI Binance launchpool 2024 🤑 || Free Airdrop Binance in  2024 😱 FREE,2024-01-05T10:32:14Z,Claim Free XAI Token - XAI Binance launchpool 2024 | Free Airdrop Binance 2023 #binance @free @TechieHome ...
,alDwzKyk2E4,XAI GAMES NODE ПРИНЕСЕТ БОЛЬШИЕ ИКСЫ? НОВАЯ ИГРОВАЯ НОДА.,2023-12-23T22:04:38Z,xai #xaigames #xainode #galagames Сайт https://xai.games/ Ссылка с примером установки ...
,gMZn7tWs_NI,XAI Crypto Coin Price Analysis And Prediction,2024-07-29T19:27:32Z,"You can buy XAI on Binance, below is the link: https://www.binance.com/?ref=11256882 For best trading signals join as a Patreon ..."
,xyXhCJJ2tL4,Xai Token Price Prediction | Xai token price | Xai coin price prediction,2024-02-03T16:27:00Z,binancelaunchpool #binance #launchpool #xai #xaitoken #xaitokenprice #xaitokenpriceprediction #xaicoin #xaiairdrop #xaicoin ...
,jcFYCW5s2rE,XAI BLOCKCHAIN LAYER 3 ARBITRUM KHUSUS UNTUK GAMING,2023-09-19T10:26:25Z,OKX Exchange: https://www.okx.com/join/11913486 Yunepto Official Link: https://link3.to/yunepto ...
,XxDkz-HG4I4,ANÁLISE TOKEN XAI PONTOS DE COMPRA,2024-01-20T16:06:50Z,
,TVTDxG-qy0g,🔥 xAI TOKEN PRESALE OFFICIAL! 🌐 XAI26R XAI41S XAI29R XAI17Q XAI83O XAI95P XAI71N,2024-11-01T02:54:32Z,XAI64F Presale: https://xaiofficial.com Discover the next big opportunity in cryptocurrency with XAI64F – a powerful altcoin set to ...
,b583UaAH6ss,Analisa Kripto - Apakah Projek Digiverse menarik? XAI calon TOP leader narasi GameFi?,2024-02-07T13:34:21Z,"Analisa Kripto - Apakah Projek Digiverse menarik? XAI calon TOP leader narasi GameFi? Hai Guys, Ini adalah segmen Analisa ..."
,XaNF8v-s92c,XAI76H  🔥 XaI TOKEN Presale Official website:🌐 https://project-xai.com  XAI89M XAI30H XAI23T XAI24X,2024-10-08T07:59:56Z,"Presale Official website:   https://project-xai.com Welcome to the official YouTube channel of XAI-TOKEN coin, where we bring ..."
,k5neMYsFvaY,XAI73P  - How to Buy xAI&#39;s New Crypto Token (2024),2024-10-14T20:02:32Z,XAI Presale : https://xaiofficial.com Discover the next big opportunity in cryptocurrency with XAI – a powerful altcoin set to ...
,zEHSQ_lZ6uk,🔥 XaI TOKEN Presale Official 🌐 https://project-xai.com  XAI89M  XAI24X XAI84D XAI94X XAI37T XAI24X,2024-10-08T17:03:16Z,"Presale Official website:   https://project-xai.com Welcome to the official YouTube channel of XAI-TOKEN coin, where we bring ..."
,LBJDqNUeIFk,$100 Claim Free XAI Token 🚀 - XAI Binance launchpool 2024 🤑 | Free Airdrop Binance 2023 😁,2024-01-04T10:58:25Z,TechieHome #freeairdrop #binancelaunchpool #NFPrompt #nfplaunchpool Second Channel: ...
,91FNwbEwBKk,Xai network token Price #xai #xaitoken #xaiprice #abitrum #arbitrum #badbunny,2024-01-10T23:15:20Z,https://t.me/TheMoneyBagsMansion.
,9Qojt334xMc,Binance Gives Free Token! | New Launchpool Project XAI #shorts,2024-01-04T08:11:09Z,"Binance's new launchpool project starts on January 5. XAI, which is on the Arbitrum network, is a gaming project with many strong ..."
,7GqqGeBF1AM,Step-by-Step Guide to Buying Elon Musk&#39;s XAI60X Token (2024),2024-10-17T14:09:31Z,XAI Presale : https://xaiofficial.com Discover the next big opportunity in cryptocurrency with XAI – a powerful altcoin set to ...
,LxBLHMKWcq0,Binance Launchpad Launchpool 4 Days event XAI Gaming Token #harvest #launchpad #launchpool #binance,2024-01-05T02:54:50Z,"Hi Friends, Welcome to my YouTube Channel “Earn Crypto with Hemant”. Here I share free crypto earning Faucet Websites, ..."
,cY4XQAfXa7w,Xai Token Price Prediction | Xai token price | Xai coin price prediction,2024-02-12T10:35:31Z,binancelaunchpool #binance #launchpool #xai #xaitoken #xaitokenprice #xaitokenpriceprediction #xaicoin #xaiairdrop #xaicoin ...
,L5U8DdnPvbA,XAI Prediction 01/JUL XAI Coin Price News Today - Crypto Technical Analysis Update Price Now,2024-07-01T16:46:43Z,THE BEST EXCHANGE FOR TRADING : https://bit.ly/Mexcinfos NEW TELEGRAM : https://t.me/Officialcryptoinfos Price News ...
,SeKPbdpbB60,BINANCE LAUNCHPAD TUTORIAL: BINANCE LAUNCHPOOL | Earn Xai Tokens by Staking  | HOW TO EARN $1000,2024-01-04T10:16:38Z,This video will teach you how to use the #binance launch pad and Binance #launchpool You will learn how to earn Xai (XAI) ...
,_g7l-nqo_RY,Come Guadagnare con Binance Launchpool💸 XAI Token,2024-01-05T16:51:05Z,Usa il LINK per ottenere lo SCONTO !!! ⏩ https://bit.ly/EdoardoMattei_BINANCE (10% di sconto sulle commissioni PER SEMPRE ) ...
,ln2uDjvUDCM,Xai Token Price Prediction | Xai token price | Xai coin price prediction,2024-01-09T12:48:45Z,binancelaunchpool #binance #launchpool #xai #xaitoken #xaitokenprice #xaitokenpriceprediction #xaicoin #xaiairdrop #xaicoin ...
,5A1OBEDafxU,Grok (XAI) Token Reivew || What is XAI Coin,2023-11-06T22:09:27Z,In this video I am going tell you about Grok (XAI) Token. This video is only for educational purpose. Do your own research for the ...
,AgQkeFkZnBI,Xai Token Price Prediction | Xai token price | Xai coin price prediction,2024-01-15T05:15:58Z,binancelaunchpool #binance #launchpool #xai #xaitoken #xaitokenprice #xaitokenpriceprediction #xaicoin #xaiairdrop #xaicoin ...
,cDl8cn3wgUg,🔥 xAI TOKEN PRESALE OFFICIAL! 🌐 XAI26R XAI41S XAI29R XAI17Q XAI83O XAI95P XAI71N,2024-11-01T02:55:09Z,XAI64F Presale: https://xaiofficial.com Discover the next big opportunity in cryptocurrency with XAI64F – a powerful altcoin set to ...
,xsLEilOvVyI,"XAI USDT SideShift Token Preço, Gráfico, Capitalização de Mercado",2024-01-09T14:32:24Z,
,svE5kzVt7Ww,Binance Launchpool earning opportunity| Farm XAI TOKEN FREE | BNB REWARDS,2024-01-04T06:43:21Z,earncryptofree #binancepay #earncrypto #binance #wotd #binancewodl #binanceoffer #biggestcryptooffer #newcryptooffer ...
,oIS_TAA4vuM,XAI Pre-Sale: Unlock the Potential of Responsible AI and Invest in Change,2024-10-31T20:05:26Z,Get Your XAI Presale: https://xaitoken.xyz/ The XAI Pre-Sale Token represents a pivotal opportunity in the rapidly evolving ...
,WR285tMZ9G0,$GROOOOOK - GROOOOOK TOKEN CRYPTO COIN HOW TO BUY GROOOOK MEMECOIN xAI ELON MUSK GROK AI BNB BSC,2023-11-25T23:53:54Z,REFERRAL CODES MEXC REFERRAL CODE... https://www.mexc.com/register?inviteCode=mexc-1FHY2 CoinEX REFERRAL ...
,IQhh8khvevI,Rủi ro của token XAI ? | Sang LV  #blockchain #crypto #sanglv,2024-02-29T02:00:07Z,DONATE❤️  MoMo: 0359 208 835 VCB: 0071 0008 53703 - Luu Van Sang Binance Pay: sanglv94@gmail.com Paypal: ...
,Y8oi-7poQsc,TOP 10 Altcoins 50x to 100x Potential - XAI59B AI Official Release Confirmed! XAI TOKEN will rise !,2024-10-28T03:34:19Z,XAI59B Token presale is live now : http://xai59b.com/ 00:00 XAI34C: The 100X Altcoin You Can't Afford to Miss! 00:01 Elon Musk's ...
,IxcygWuVOmI,XAI Token｜Grok Build｜#ElonMusk｜#XAI Token 2024｜NEW ATH IN 2024 - INR 10?｜Best AI Crypto｜#GrokXAI 10X,2023-11-07T02:00:49Z,About this Video: What is XAI Token? / How to buy XAI Token? GROK-XAI crypto explained. Grok is an AI blockchain project that ...
,Oa0zLdyrzps,XAI token Free Claim Aridrop En Binance AccountDaily claim $5 too $50#foryou #viralvideo,2024-01-07T18:16:22Z,XAI token Free Claim Aridrop En Binance Account Daily claim $5 too $50 Click this link Free Claim Aridrop Binance ...
,pljkMcefToU,XAI Token Airdrop CLAIM &amp; 400% Profit Soon | Xai Token Latest News Today | XAI Price Prediction 2024,2024-01-14T17:36:17Z,DISCLAIMER:¬ This video is only information and educational Purposes this is not an investment advice am not a financial ...
,EWKDlVR4rio,Xai Token Price Prediction | Xai token price | Xai coin price prediction,2024-01-13T06:26:37Z,binancelaunchpool #binance #launchpool #xai #xaitoken #xaitokenprice #xaitokenpriceprediction #xaicoin #xaiairdrop #xaicoin ...
,k3BJDT-CDw0,Xai Token Price Prediction | Xai token price | Xai coin price prediction,2024-01-24T12:38:54Z,binancelaunchpool #binance #launchpool #xai #xaitoken #xaitokenprice #xaitokenpriceprediction #xaicoin #xaiairdrop #xaicoin ...
,WuBzhKYzqwg,Meme Coinlerde Rekor Bekleniliyor😳 BTC  57.000 $ Seviyesinde 💣 XAI Token Kilit Açılımı🔑 BTC ETH PEPE,2024-07-09T06:35:15Z,"Yağmur Bayoğlu, #Bitcoin ve #altcoin piyasalarına etkisi olan kripto para güncel gelişmeleri değerlendiriyor. 1- Analistler Meme ..."
,SiTv0ub896c,"BNB TUSD STACK EARN FREE TOKEN , XAI FREE TOKEN ON 🔥😀 #crypto #yt #btc #MINNING",2024-01-04T14:06:26Z,"BNB TUSD STACK EARN FREE TOKEN , XAI FREE TOKEN ON #crypto #yt #btc #MINNING like ll share ll subscribe use my ..."
,nbLX-X3oUls,Nova Launchpad da Binance corre e garanta seus Tokens $XAI,2024-01-05T00:53:52Z,corre deixe BNB em staking e Farme tokens XAI durante 4 dias... aproveite.
,XjLLvqeqYUs,🔥 xAI TOKEN PRESALE OFFICIAL! 🌐XAI87Q  XAI63O  XAI51N  XAI37L  XAI25K  XAI13J  XAI90I,2024-10-30T22:27:50Z,"This is life changing opportunity for me, especially when price of Bitcoin currently going sideways. XAI Presale ..."
,azN4g-RQugs,PIXEL XAI TO PUMP हो गया अब दूसरा Token कौन है जो जल्दी में 50% से 100% का ptofit देगा | 100x Token,2024-10-30T07:10:51Z,Telegram group @TEWONCrypto https://t.me/TEWONCrypto Telegram mining listing bot only group ...
,TAARhL-IPVs,Trending $UMA $XAI and $MANTA TOKEN Analysis | Grab Rewards With COINEX 2024,2024-01-26T09:48:56Z,Join Us On YOUTUBE | TELEGRAM | INSTAGRAM visit link : https://lnk.bio/amitandcrypto ✓ CoinEx Registration Link ...
,TAARhL-IPVs,Trending $UMA $XAI and $MANTA TOKEN Analysis | Grab Rewards With COINEX 2024,2024-01-26T09:48:56Z,Join Us On YOUTUBE | TELEGRAM | INSTAGRAM visit link : https://lnk.bio/amitandcrypto ✓ CoinEx Registration Link ...
,NSeJy1K8vic,₹16 का Coin ₹140 तक | Xai 3500% | Alex 2800% &amp; New Listing,2024-01-09T11:50:25Z,Hey Everyone Kaise hain aap Sab Telegram Channel - https://t.me/oyeeerahul1 YFII - https://youtu.be/lM-0bjc99l4 Fan Tokens ...
,FNw88S7Qc1c,Binance Xai (XAI) Token Nedir? Nasıl farm yapılır ve satın alınır?,2024-01-03T22:19:16Z,Binance yeni listeleme Launchpool 43. Proje: Xai (XAI) Token Nedir? Nasıl farm yapılır ve alınır? %20 Komisyon indirimi ile üyelik: ...
,pMaTeVArVOU,XAI COIN CHART EVALUATION: FUTURE OUTLOOK! XAI COIN PRICE MOVEMENTS: CHART INSIGHTS !,2024-09-04T09:00:28Z,TO SUPPORT OUR CHANNEL YOU CAN CONTRIBUTE IN THE BELOW MENTIONED DETAILS or JOIN THE MEMBERSHIP ...
,DDXIzkrdtUs,"Sự kiện airdrop token XAI từ sàn Bybit, cơ hội nhận từ 100 - 400 USDT",2024-01-09T12:57:22Z,"Folow TCX1000BTC qua các kênh. Nhóm trao đổi kiến thức, tín hiệu ❇️ Trade Spot : https://t.me/TCX1000BTC ❇️ Airdrop ..."
,jdoTGGiuuiw,Xai Token Price Prediction | Xai token price | Xai coin price prediction,2024-01-10T06:33:00Z,binancelaunchpool #binance #launchpool #xai #xaitoken #xaitokenprice #xaitokenpriceprediction #xaicoin #xaiairdrop #xaicoin ...
,IP0WbSuK2sU,TOP 9 AI Crypto Coins That Can 100x By May (Pump SOON List),2024-03-09T16:50:05Z,AI is one of the most pumpy freaky strong niches in crypto BUT most haven't spotted it...YET...Here's what will pamp extremely ...
,BuQExLIasF4,How to make money with Kucoin Pre Market Trade XAI before its listing,2023-12-23T16:00:11Z,"ilmeaalim, #gridbot , #kucoin Learn how to cryptocurrencies before they even officially launch on KuCoin Pre-Market Trading or ..."
,d1FaorKDhZI,#xai token $1000 airdrop claim Is Live,2023-12-26T17:19:37Z,https://nfprompt.io/earn?invitecode=21KmLXMj- https://app.brcapp.com/account/sign-up?r=Bittham ...
,OEnoUI0F5U8,🤑🤑🤑HACIENDO PLATA CON EL TOKEN XAI SIN INVERSION🔴,2024-01-06T02:00:05Z,CREA TU CUENTA EN BINANCE https://www.binance.com/en/activity/referral-entry/CPA?ref=CPA_CPAIRIHOPHW NUEVO ...
,M36a9C-7xds,"Binance labs के project मे(manta,xai,pixel,ena -80%) invest किए हो तो 🤯अब ये होने वाला है don&#39;t miss",2024-08-13T06:09:16Z,Welcome boss Aaj ke es video M hamlog bat karege waise project ke bare M jo binance launchpad pr list hue hai jo aaj apni ...
,CAeBAYoISTE,XAI TOKEN || ByBit TOKEN Splash Guide || by Pawansatoshi #xai #bybit #freeairdrop #freeairdroptoken,2024-01-09T14:25:43Z,https://www.bybit.com/invite?ref=DR6DMA Refferal code DR6DMA https://t.me/pawan_satoshi ( subscribe telegram channel) ...
,J6nqv_LcyH8,&quot;🚀 XAI Token Price Prediction After Binance Launchpool Listing! 🌐 | Binance Lists XAI | CRYPTO RKB&quot;,2024-01-06T08:30:04Z,Wondering about the future of XAI Token after its Binance Launchpool listing? Join CRYPTO RKB in this video for an insightful ...
,l1jpfBQtpCQ,💥NEW Binance Launchpool Announced! How to Earn FREE Xai (XAI) Tokens💸 English,2024-01-05T06:30:17Z,Cryptocurrency Trading and latest updates: Subscribe Here   ...
,Cv06TZyxnvc,XAI Coin Vs Ai Coin | XAI and Sleepless Ai Price Prediction,2024-01-09T02:30:11Z,This video we discuss if we shall buy XAI coin after listing on binance or we shall wait for some time. and also price prediction of ...
,m7nmIi-MDlc,XAI Prediction 28/SEP XAI COIN Price News Today Crypto Technical Analysis Update Price Now,2024-09-28T20:50:47Z,THE BEST EXCHANGE FOR TRADING : https://bit.ly/100Bitget NEW TELEGRAM : https://t.me/Officialcryptoinfos Price News ...
,G0yIQfMGPZc,Binance Launchpool 43. Proje: Xai (XAI) Token Nedir? Nasıl farm yapılır ve alınır?,2024-01-03T12:45:36Z,Binance yeni listeleme Launchpool 43. Proje: Xai (XAI) Token Nedir? Nasıl farm yapılır ve alınır? %20 Komisyon indirimi ile üyelik: ...
,UBEjbBEYPY8,𝐗𝐀𝐈 𝐎𝐑 𝐍𝐀𝐊𝐀𝐌𝐎𝐓𝐎 ? 𝐖𝐇𝐈𝐂𝐇 𝐈𝐒 𝐁𝐄𝐓𝐓𝐄𝐑 ? 𝐓𝐎𝐏 𝟓 𝐁𝐄𝐒𝐓 𝐆𝐀𝐌𝐈𝐍𝐆 𝐂𝐑𝐘𝐏𝐓𝐎 𝐂𝐎𝐈𝐍𝐒 | 𝐗𝐀𝐈 𝐂𝐎𝐈𝐍 | 𝐍𝐀𝐊𝐀 𝐂𝐎𝐈𝐍,2024-06-03T13:46:49Z,XAI OR NAKAMOTO ? WHICH IS BETTER ? TOP 5 BEST GAMING CRYPTO COINS ...
,PSiXVLsG7eE,This Crypto Gaming Node Makes Me $1000 Each Month!,2024-02-06T21:27:13Z,Join the FREE Discord: ▻ https://discord.gg/qADxWtazSw ▭▭▭▭▭▭▭▭▭▭▭▭▭▭▭▭▭▭▭▭ Need a VPN?
,cBJz2yxiaPw,Xai Token Price Prediction | Xai token price | Xai coin price prediction,2024-07-15T07:47:34Z,binancelaunchpool #binance #launchpool #xai #xaitoken #xaitokenprice #xaitokenpriceprediction #xaicoin #xaiairdrop #xaicoin ...
,HXAhTliGQo4,Binance Yeni Listeleme Xai Token (Xai) Token nasıl satın alınır? Adım adım Kılavuz,2024-01-09T19:43:11Z,Binance Yeni Listeleme Xai Token (Xai) Token nasıl satın alınır? Adım adım Kılavuz %20 Komisyon indirimi ile üyelik: ...
,KetUXVUY2lk,BYBİT XAİ AİRDROP - TÜM KULLANICILARA 45$ DEĞERİNDE 30 XAİ TOKEN,2024-03-11T13:00:10Z,Bybit borsasının dağıtacağı Mavia airdropunu sakın kaçırmayın arkadaşlar. Görevler zor görünebilir ama 10 dakikada halledilecek ...
,Q7lBZuLSx_4,ONDO BINANCE LISTING || XAI TOKEN HIDDEN SECRET || QUALITY CONTENT || CRYPTO HINDI || INDIA,2024-07-07T13:35:44Z,"TELEGRAM - https://t.me/MUKULCRYPTOZONE not a financial advisor dyor Hey Crypto Fam! Mukul Crypto Zone here, diving ..."
,ZqrfNQ9vT2Y,How To Get Xai Crypto Tokens Free From Binance launchpool I #ai,2024-01-04T12:00:29Z,XAI is a gaming blockchain built on top of Arbitrum as its first L3 ✨ Sing Up ...
,qvlCr2SuIvo,Xai Token Airdrop 🎉 | Binance New Listing XAI | How To Get Maximum Profit?,2024-01-09T06:50:00Z,Xai Token Airdrop | Binance New Listing XAI | How To Get Maximum Profit? Xai (XAI) Binance Launchpool | 75000000 XAI ...
,UNARkXMPRio,CLAIM OVER $500 XAI FREE TOKEN NOW IN TRUST WALLET | CRYPTO AIRDROP,2024-01-12T00:00:22Z,"In this video, I'll show you how I claimed new XAI TOKEN of over $500 in a token giveaway! By joining my cryptoaugmented trust ..."
,jW_0o4srGDM,Xai Coin Price Prediction 🔥🚀 - best crypto to invest in 2024 💎,2024-01-18T11:33:15Z,Xai Coin Price Prediction - best crypto to invest in 2024 ✓Telegram https://t.me/THE_CRYPTO_CHIPS ✓TWITTER ...
,jnWyGxEryP8,Hướng dẫn Airdop Bybit &amp; XAI Token - Nhận 35 XAI (Ngon),2024-03-12T14:24:28Z,Hướng dẫn Airdop Bybit & XAI Token - Nhận 35 XAI (Ngon). Mở khóa phần chia sẻ của bạn trong tổng giải thưởng 1.025.000 XAI ...
,-_UBEkVFFV4,XAI TOKEN HUGE PRICE PUMP! XAI CRYPTO PRICE PREDICTION | xai coin news update today,2024-01-16T04:00:44Z,"XAI TOKEN HUGE PRICE PUMP! XAI CRYPTO PRICE PREDICTION | xai coin news update today SK Unique Tech,Crypto news ..."
,KAVqe-cSI_0,$100 Claim Free ($XAI) Token 🚀 🔥10X - 60X ICO- XAI Binance launchpool 2024 🤑 | #xai #gns #binance,2024-01-04T17:36:32Z,10X - 60X XAI ($xai) ICO Binance Listing XAI | Layer 3 Blockchain for AAA Gaming | Launchpad | GNS Lets Join ...
,aBl1l-P63No,How To Get Started with XAI48E AI Token: Beginner&#39;s Guide to 100X Altcoins,2024-10-29T15:57:23Z,"Official Presale Link: https://xaiofficial.com My name is Sam, and on this channel, I teach you about personal finance and crypto ..."
,-5e6RxJwZls,XAI Price Prediction. Should you buy XAI Coin Now?,2024-01-24T15:05:59Z,"XAI Price Prediction. Should you buy XAI Coin Now? DM me ""4LIGHT"" -10% code, for Indicators set - https://t.me/vladi4light ..."
,9eqZo7-vvM4,"NEW Binance Launchpool XAI | Gaming blockchain Token! Stake BNB, TUSD and FDUSD to Farm XAI",2024-01-03T16:17:17Z,"This time early to the game, check out my video about the new launchpool from Binance. 43rd Launchpool, covering XAI Projects ..."
