Channel ID,Video ID,Vidoe Title,Date Published,Description
,73Rh95MsnhQ,🔥xAI TOKEN PRESALE OFFICIAL! 🌐https://project-xai.com XAI84P XAI50P XAI32P XAI48T XAI23X XAI59X,2024-10-17T08:40:06Z,"Presale Official website:   https://project-xai.com Welcome to the official YouTube channel of XAI-TOKEN coin, where we bring ..."
,wQ8Glbf_Ge8,XAI NOVA L3 EXPLODINDO VOLTADA PARA GAMES COM 0 TAXA NA ETHEREUM,2024-01-14T14:30:16Z,GRUPO DE ANALISE DO CANAL https://chat.whatsapp.com/Li0lttHBFnh3tLTzdwpsPU BÔNUS COINEXT CADASTROU ...
,Uv1yygk9np4,🔥 xAI TOKEN PRESALE OFFICIAL! 🌐 https://project-xai.com  XAI22M XAI51H XAI48H XAI76H XAI94X,2024-10-11T07:54:13Z,"Presale Official website:   https://project-xai.com Welcome to the official YouTube channel of XAI-TOKEN coin, where we bring ..."
,EUwLPlj2oPw,XAI Crypto: Opportunities and Risks Uncovered 💰📉  Smart Move or Risky Bet? 🤔📊,2024-08-26T20:01:22Z,"Everything You Need to Know About XAI Token Hello everyone. Today, we will delve into a comprehensive analysis of the ..."
,EhEtRE6Vc3c,ELON MUSK YAPAY ZEKA PROJESİ XAI SAHTE KRİPTO PARASI ÇIKACAK!,2023-04-14T22:38:33Z,Elon musk yapay zeka tarafına el attı. Resmi olarak OpenAI ChatGPT rakibi X․AI Corp.'u kurdu. Dolandırıcılar durur mu hemen bu ...
,EHmcdM559lA,XAI Crypto Coin Price Analysis And Prediction,2024-07-26T19:56:38Z,"You can buy XAI on Binance, below is the link: https://www.binance.com/?ref=11256882 For best trading signals join as a Patreon ..."
,tGtcNTdYcFY,Be Part of the AI Revolution Grab Your XAI Pre Sale Token Today 🚀🚀,2024-11-01T12:52:54Z,Go get your XAI Pre-Sale Tokens Here : https://xaitoken.xyz/ The XAI Pre-Sale Token is your gateway to investing in the future of ...
,Q0EpB7WVFLA,"XAI Presale: Don&#39;t Wait Until 2025, New round could value AI startup at $40 billion",2024-10-31T19:10:01Z,"XAI Presale: Don't Wait Until 2025, New round could value AI startup at $40 billion XAI Presale: https://presale.investxai.xyz ..."
,AXk69fxhvbA,This Gaming Token (XAI Token) Is Changing The Game - How High Can XAI Coin Go?,2024-02-29T14:14:02Z,"The XAI gaming token, associated with the Xai gaming network on the Ethereum scaler Arbitrum, has achieved a significant ..."
,6d95h0eOatc,XAI Coin News Today! XAI Price Prediction &amp; update,2024-05-22T04:00:07Z,Binance 7 to 10 Future Trading signals Join Telegram Telegram Free Signals Group Join Now https://t.me/abcryptovip Telegram ...
,mHza6i-AbxE,An Easy Way to Become a Crypto Millionaire!$xAi token #crypto #memecoin #bitcoin #xai,2023-07-12T20:08:20Z,
,zDWSG1HB1i4,XAI Crypto Coin Price Analysis And Prediction,2024-08-13T18:57:06Z,"You can buy XAI on Binance, below is the link: https://www.binance.com/?ref=11256882 For best trading signals join as a Patreon ..."
,urS5EhgrouA,XAI Crypto Coin Price Analysis And Prediction,2024-08-28T12:46:12Z,"You can buy XAI on Binance, below is the link: https://www.binance.com/?ref=11256882 For best trading signals join as a Patreon ..."
,jWXS1DFTJ1k,XAİ NEDİR ? XAI COİN İNCELEME,2024-01-11T15:00:42Z,iyi seyirler . telegram link : https://t.me/kriptoisletmecisi . linkler = binance : https://accounts.binance.info/register?ref=KRGDF8BP ...
,Ty9stJDMHvo,XAI44H  - How to Buy xAI&#39;s New Crypto Token (2024),2024-10-14T20:58:01Z,XAI Presale : https://xaiofficial.com Discover the next big opportunity in cryptocurrency with XAI – a powerful altcoin set to ...
,vNw4JGpwYcU,Invest in Tomorrow Get Ahead with the XAI Pre Sale Token for Ethical AI ✅,2024-10-31T23:47:26Z,Go get your XAI Pre-Sale here now : https://xaitoken.xyz/ The XAI Pre-Sale Token offers a unique opportunity for investors to ...
,EGZdEcifnQY,XAI48H - How to Buy xAI&#39;s New Crypto Token (2024),2024-10-12T13:57:59Z,XAI Presale : https://xaiofficial.com Discover the next big opportunity in cryptocurrency with XAI – a powerful altcoin set to ...
,UEZf3sceb6E,XAI Crypto Coin Price Analysis And Prediction,2024-09-05T18:23:20Z,"You can buy XAI on Binance, below is the link: https://www.binance.com/?ref=11256882 For best trading signals join as a Patreon ..."
,u4mLw0YIxGk,XAI Token! Dieser neue Altcoin sieht sehr Interessant aus!,2024-01-17T19:45:35Z,altcoins #krypto.
,M9y7JqRcDBk,What is Xai (XAI) Coin | Review About XAI Token,2024-01-09T23:17:15Z,"In this video, I will share a Review of the Xai (XAI) token. I have collected all the data from online sources please don't take this ..."
,9467S4s0kMs,XAI Token Price Predictions 2024 Bull Run Targets | XAI Gaming Airdrop Token Price Analysis Hindi,2024-03-01T10:12:52Z,XAI Token Price Predictions 2024 Bull Run Targets | XAI Gaming Airdrop Token Price Analysis Hindi Telegram     ...
,FIvQoPPDuMQ,XAi Token Review | Secure Blockchain #pinksale #crypto,2023-04-18T08:30:04Z,"AXi Token Review | Secure Blockchain XAi - The Ultimate all-in-one mobile app: Social networking, e-commerce, messaging, ..."
,TF-qMAUDANU,XAI Token Skyrockets 30% With Binance Listing! Is It Too Late To Buy XAI Crypto?,2024-01-16T13:43:51Z,"The XAI token has experienced a significant surge in its value following its listing on Binance, one of the world's largest ..."
,vVHf1XuRee4,XAI Prediction 25/AUG XAI COIN Price News Today Crypto Technical Analysis Update Price Now,2024-08-25T14:52:20Z,THE BEST EXCHANGE FOR TRADING : https://bit.ly/100Bitget NEW TELEGRAM : https://t.me/Officialcryptoinfos Price News ...
,r5OCPATMSro,XAI GEMA A PUNTO DE EXPLOTAR EN BINANCE EN POCOS DIAS🚀 COMO COMPRAR?#crypto #binance #bitcoin #token,2024-01-04T21:54:10Z,"TOKEN XAI EN BINANCE NUEVO LAUNCHPOOL A PUNTO DE EXPLOTAR SOY OSIAS, recuerden que no dejo ..."
,dK9mD9F3flI,Invest in a Smarter Future: XAI Presale Tokens Available Now,2024-11-01T08:22:50Z,XAI Presale: https://presale.investxai.xyz Discover the next big crypto opportunity with XAI. Why XAI? First major coin for merchant ...
,Axxmma3BmEo,---🔥 xAI TOKEN PRESALE OFFICIAL! 🌐  XAI10R XAI11M XAI12P  XAI14W XAI32D XAI37H XAI37H  XAI41T,2024-10-30T12:20:11Z,Presale Official website:   https://xai-official.web.app/ XAI10R XAI10R XAI11M XAI11M XAI12P XAI12P XAI14W XAI14W XAI32D ...
,agorJL8nvJY,XAI Coin Big News 😱| Xai Coin Price Prediction 2024  | Xai Crypto,2024-07-18T08:12:10Z,xaicoin #xaicrypto #xaicoinpriceprediction2024 my telegram link - https://t.me/technocrazy21.
,ol-X9U1yMos,xAI TOKEN PRESALE OFFICIAL 🌐XAI87Q XAI63O🔥!,2024-11-01T12:32:59Z,XAI Presale: https://xaigswap.web.app Discover the key benefits and importance of participating in the XAI pre-sale: Early Access ...
,gEQ2fBG8nbM,12yr old Indian Crypto-Millionaire - 240Cr. Rupees within 1 YEAR! | True Story 💲💲 #shorts,2021-08-09T16:03:49Z,Meet 12yr old Indian Crypto-Millionaire Gajesh manages 240Cr. Rupees #shorts The cryptocurrency craze which has ...
,O3BBi0ZLfGI,XAI Crypto Coin Price Analysis And Prediction,2024-08-25T18:45:14Z,"You can buy XAI on Binance, below is the link: https://www.binance.com/?ref=11256882 For best trading signals join as a Patreon ..."
,ceUfoQqFJtQ,Binance Free Earning 100$ | Binance New Airdrop | XAI Token Binance Airdrop,2024-01-05T13:15:19Z,Hello Friends ☎️Telegram Channel       https://telegram.me/RahulPawaria01 Twitter       ...
,_zDjMIMfq8g,XAI Token Now Listed On CoinSwitch App | CoinListing #xai #crypto #bitcoin,2024-04-29T14:45:03Z,
,-r09K3Ypkho,XAI Crypto Coin Price Analysis And Prediction,2024-07-18T18:48:45Z,"You can buy XAI on Binance, below is the link: https://www.binance.com/?ref=11256882 For best trading signals join as a Patreon ..."
,1Q_e3spbk1g,🔥 xAI TOKEN PRESALE OFFICIAL! 🌐 XAI31S XAI81O XAI69N XAI57M XAI33K XAI91I XAI89H XAI77G,2024-10-31T23:23:11Z,"Presale Official website:   https://xaiofficial.com Welcome to the official YouTube channel of XAI-TOKEN coin, where we bring you ..."
,2I87BMG0Sus,New Coin (Crypto) SideShift Token (XAI) has been listed On MEXC,2023-07-31T12:39:32Z,
,kFOhv2dC1TY,XAI Crypto Coin Price Analysis And Prediction,2024-08-06T14:55:41Z,"You can buy XAI on Binance, below is the link: https://www.binance.com/?ref=11256882 For best trading signals join as a Patreon ..."
,SFWZZ1Bf12g,XAI Crypto Coin Price Analysis And Prediction,2024-09-13T14:49:26Z,"You can buy XAI on Binance, below is the link: https://www.binance.com/?ref=11256882 For best trading signals join as a Patreon ..."
,oNS5jO1901o,Sideshift.ai&#39;s (XAI token) complete whitepaper analysis in detail.,2024-01-09T15:52:36Z,"Hi all, In this video, we will analyze Sideshift.ai's (XAI token) complete whitepaper in detail. Join my telegram group here: ..."
,xfKLxDePH9A,"Token Name Xai (XAI)Max Token Supply: 2,50crror Launchpool Token Rewards #stake #farming #yt #btc",2024-01-04T00:30:24Z,Token Name: Xai (XAI) Max Token Supply: 2500000000 XAI Launchpool Token Rewards: 75000000 XAI (3% of total token ...
,xfKLxDePH9A,"Token Name Xai (XAI)Max Token Supply: 2,50crror Launchpool Token Rewards #stake #farming #yt #btc",2024-01-04T00:30:24Z,Token Name: Xai (XAI) Max Token Supply: 2500000000 XAI Launchpool Token Rewards: 75000000 XAI (3% of total token ...
,ZPu2I7l8j6Q,Xai Token Price Prediction | Xai token price | Xai coin price prediction,2024-06-19T14:44:54Z,binancelaunchpool #binance #launchpool #xai #xaitoken #xaitokenprice #xaitokenpriceprediction #xaicoin #xaiairdrop #xaicoin ...
UCE9fL1gPFEpa9-XO_UBi5bQ,,XAI Token,2006-03-30T20:41:04Z,
,ZXMIj4tDMbg,XAI Prediction 20/JUN XAI Coin Price News Today - Crypto Technical Analysis Update Price Now,2024-06-20T23:05:13Z,THE BEST EXCHANGE FOR TRADING : https://bit.ly/Mexcinfos NEW TELEGRAM : https://t.me/Officialcryptoinfos Price News ...
,Gjhe6s-EZcs,Xai binance airdrop || xai binance token || binance launchpad tutorial || binance xai token claim,2024-01-06T10:16:39Z,Xai binance airdrop || xai binance token || binance launchpad tutorial || binance xai token claim #binance #xai #binancetoken ...
,UuVE6w7uL2A,"XAI é a criptomoeda do momento! Quanto vale? Elon musk na parada? é lua,Vai fazer novos Milionários",2023-07-26T14:02:33Z,3 MÊS SALA DE SINAIS + MINI CURSO +MEU INIDICADOR DE FUTUROS   https://pay.kiwify.com.br/c0AXul2 XAI TOKEN: ...
,1AatQOH68Dw,🔥 xAI TOKEN PRESALE OFFICIAL! 🌐 XAI95F  XAI44E  XAI53D  XAI62C  XAI51B  XAI40A,2024-10-30T22:30:41Z,"This is life changing opportunity for me, especially when price of Bitcoin currently going sideways. XAI Presale ..."
,FiQo8z4nxJM,🔶NUEVA OPORTUNIDAD LAUNCHPOOL DE BINANCE ! XAI  TOKEN (XAI ),2024-01-04T20:19:19Z,
,D10TW7m8AQE,🔥 xAI TOKEN PRESALE OFFICIAL! 🌐 XAI83Y  XAI71X  XAI59W  XAI47V  XAI35U  XAI11S,2024-10-30T22:26:16Z,"This is life changing opportunity for me, especially when price of Bitcoin currently going sideways. XAI Presale ..."
,BuVJWJiARvw,XAI Game List Binance | Token $XAI X60 Lần Dẫn Đầu Trend GameFi Năm 2024,2024-01-11T12:10:22Z,binance #xaigame #gamefi XAI Game List Binance | Token $XAI X60 Lần Dẫn Đầu Trend GameFi Năm 2024 ▻Danh mục đầu tư ...
,lAKXoCE7Xps,Xai Gaming Coin | Arbitrum Xai Token Price | Blockchain Gaming,2024-02-27T17:45:06Z,Are you from the USA or Canada you can deposit $100 #usdt and get free $100 #usdt coupon for perpetual contract bonus       ...
,3Qvt4XrIF9s,XAI31M - Step-by-Step Guide to Buying xAI&#39;s XAI31M Token (2024),2024-10-14T15:59:26Z,XAI Presale : https://xaiofficial.com Discover the next big opportunity in cryptocurrency with XAI – a powerful altcoin set to ...
,KpkOflXzRXk,"Обзор на XAI, Новый AXS? Бычий настрой",2024-01-28T11:37:43Z,"CoinW https://www.coinw.com/front/invitePublicity?r=DOGETRADER (Без КУС + 1000$) Xai — это layer3 в экосистеме ARB, ..."
,NzZTRJsuhI4,🔥 xAI TOKEN PRESALE OFFICIAL! 🌐 XAI30U  XAI58S  XAI87R  XAI76Q  XAI35P  XAI54O,2024-10-30T22:28:51Z,"This is life changing opportunity for me, especially when price of Bitcoin currently going sideways. XAI Presale ..."
,pcP3eKeAtHE,🔥 xAI TOKEN PRESALE OFFICIAL! 🌐 XAI65F XAI50N XAIXAI36L XAI24K XAI12J XAI92I XAI80H XAI30C,2024-10-31T23:22:26Z,"Presale Official website:   https://xaiofficial.com Welcome to the official YouTube channel of XAI-TOKEN coin, where we bring you ..."
,2pQT8QbAok0,OFFICIAL PRESALE WEBSITE FOR xAI TOKEN: https://project-xai.com &quot;XAI87T XAI94X XAI22F XAI76H XAI22M&quot;,2024-10-10T11:11:21Z,"Presale Official website:   https://project-xai.com Welcome to the official YouTube channel of XAI-TOKEN coin, where we bring ..."
,d3NBnERKAOc,"MODAL $300 POTENSI JADI $443,004 XAI CHAIN LAYER 3 ARBITRUM",2023-10-27T13:00:37Z,"XAI CHAIN LAYER 3 ARBITRUM INI PUNYA TOKEN DIMANA 100% GAS FEE YANG DIBAYARKAN AKAN DIBURN, SUPPLY ..."
,e4PVuobUMKs,"💎Could XAI Token Skyrocket Like Floki, Doge, SHib, Baby Doge? 🚀🔮Find Out!",2023-06-01T15:05:43Z,PATREON: https://www.patreon.com/cakeandcrypto TWITTER - @cakencrypto Description: Welcome to the most exciting episode ...
,UcHkhGiQfxg,XAI Crypto Coin Price Analysis And Prediction,2024-08-31T17:01:04Z,"You can buy XAI on Binance, below is the link: https://www.binance.com/?ref=11256882 For best trading signals join as a Patreon ..."
,qyA1KO3Q5Vs,"XAI COIN HUGE NEWS! - What IS Binance&#39; Listing&#39;s XAI Token, Price Prediction &amp; Utility 2024 Coin",2024-01-13T05:00:26Z,"XAI COIN HUGE NEWS! - What IS Binance' Listing's XAI Token, Price Prediction & Utility 2024 Coin - 30000$ BONUS - Trade ..."
,DptucnU1RWU,"XAI Dự Án 43 Launchpool Trên Binance Là Dự Án Gì?, Có Gì Nổi Bật?, Game Fi Có Bùng Nổ uptrend",2024-01-09T14:33:36Z,"XAI Dự Án 43 Launchpool Trên Binance Là Dự Án Gì, Có Gì Nổi Bật, Game Fi Có Bùng Nổ Xem Thêm Tại Website: ..."
,F4yNRrMUaJs,YOU WILL REGERT NOT BUYING XAI  COIN || HERE IS WHY !!,2024-01-17T15:00:18Z,"In this video, I talked about XAI token, XAI, XAI coin, XAI coin crypto, XAI coin news, XAI price, XAI news, XAI coin news today, XAI ..."
,O_Jn8_XNTeQ,Bỏ lỡ kèo tăng xx lần SEI &amp; TIA thì XAI chính là dự án tiềm năng tiếp theo!!,2024-01-18T01:46:56Z,Bài viết review về XAI: https://kenhtrading.com/review-xai-token/ * Check lịch vesting token XAI: ...
,_QsFtZ2o8ME,Why Xai Games is up 🤩 Xai Crypto Token Analysis,2024-02-25T00:20:21Z,"Why Xai Games is up Xai Crypto Token Analysis Thank you for watching this video! Please Like, Share, Comment and ..."
,sHeOFM0lKf0,XAI22H - How to Buy xAI&#39;s New Crypto Token (2024),2024-10-11T23:57:51Z,XAI Presale: https://xaiofficial.com Discover the next big opportunity in cryptocurrency with XAI – a powerful altcoin set to ...
,vjQ6D6YsFWM,Altcoin mit viel Potential! (XAI Token),2024-01-21T14:35:33Z,Dieser #altcoin könnte jetzt eine Trendwende vollziehen und erst richtig durchstarten!
,v4hvBr2Ncm4,🔥 xAI TOKEN PRESALE OFFICIAL! 🌐 https://project-xai.com  XAI81P XAI61S XAI19F XAI60Z XAI49G XAI18Y,2024-10-25T14:33:11Z,"Presale Official website:   https://project-xai.com Welcome to the official YouTube channel of XAI-TOKEN coin, where we bring ..."
,tqCFh_1Ntg0,XAI29H - How to Buy xAI&#39;s New Crypto Token (2024),2024-10-12T21:32:32Z,XAI Presale : https://xaiofficial.com Discover the next big opportunity in cryptocurrency with XAI – a powerful altcoin set to ...
,Et7rEA_eOhE,🔥 XAI TOKEN Presale Official website:🌐https://project-xai.com  XAI10M XAI440P XAI95T XAI440P XAI47G,2024-10-07T11:51:04Z,"Presale Official website:   https://project-xai.com Welcome to the official YouTube channel of XAI-TOKEN coin, where we bring ..."
,Yj3S_Oj7jkM,"🔥Desbloqueios de tokens de julho incluem Worldcoin, XAI, Arbitrum, Aptos.",2024-07-07T22:38:59Z,"Desbloqueios de tokens de julho incluem Worldcoin, XAI, Arbitrum, Aptos e mais. #xai #crypto #bitcoin #draccrypto."
,4F-a4IDlWHU,XAI Prediction 05/JUL XAI Coin Price News Today - Crypto Technical Analysis Update Price Now,2024-07-06T14:52:41Z,THE BEST EXCHANGE FOR TRADING : https://bit.ly/Mexcinfos NEW TELEGRAM : https://t.me/Officialcryptoinfos Price News ...
,vzR9g3HZSDU,&quot;PIXELS and XAI Coin: Future Potential &amp; Price Prediction | Cryptocurrency Insights 2024,2024-07-08T06:04:40Z,Cryptocurrency #PIXELS #XAICoin #PricePrediction #CryptoAnalysis #Investing #bitcoin #cryptobangla #everythingbangla ...
,jHSYeRtBvWE,Invest Early in the Game-Changing XAI Pre-Sale Token!- Huge Opportunity 100X ALTCOIN✔️,2024-11-01T01:33:35Z,Go Get your XAI Pre-Sale Token Now https://xaitoken.xyz/ The XAI Pre-Sale Token offers a unique investment opportunity that ...
,StPBjGT4uI0,Xai - ЗАМЕНА Decentraland И The Sandbox \ ТОП ПРОЕКТ СЕГМЕНТА GameFi,2024-03-03T14:28:06Z,Кейсы с криптовалютой — https://cryptodrop.net/c/grcrypto Связь со мной в телеграм - @zethtty ✓Binance (Скидка 10% + ...
,R8bD9C2N3cw,XAI TOKEN BINANCE LISTING! XAI CRYPTO PRICE PREDICTION &amp; ANALYSIS! XAI PRICE FORECAST 2024,2024-01-09T12:30:17Z,XAI TOKEN BINANCE LISTING! XAI CRYPTO PRICE PREDICTION & ANALYSIS! XAI PRICE FORECAST 2024 Welcome back to ...
,CTE6rGCIKxo,XAI75P - How to Buy xAI&#39;s New Crypto Token (2024),2024-10-12T23:24:19Z,XAI Presale : https://xaiofficial.com Discover the next big opportunity in cryptocurrency with XAI – a powerful altcoin set to ...
,BIMWOoR7dnA,Xai Price Prediction | xai token | Xai | #shortsfeed #shorts #viral #altcoinfirst #shortsviral #xai,2024-06-03T11:45:02Z,Xai Price Prediction | xai token | Xai | #shortsfeed #shorts #viral #altcoinfirst #shortsviral #xai Follow my Telegram: ...
,xF7pzt7zh6U,"Xai Games - Blockchain Games surgindo com força no mercado, Token, Node, Jogos!",2024-02-02T16:00:47Z,"Fala pessoal! Blz? Hoje vamos falar de uma Blockchain Games que esta surgindo no mercado e vindo com força, a Xai Games, ..."
,-2sKqs9ktYo,XAI Prediction 16/JUL XAI COIN Price News Today Crypto Technical Analysis Update Price Now,2024-08-16T18:34:25Z,THE BEST EXCHANGE FOR TRADING : https://bit.ly/100Bitget NEW TELEGRAM : https://t.me/Officialcryptoinfos Price News ...
,CqGnDcdfblM,XAI Presale: Stop Waiting for the Next XRP – The Next Big Thing is Already Here!,2024-10-30T20:06:18Z,XAI Presale: https://presale.investxai.xyz Discover the Next Big Opportunity in Cryptocurrency with XAI Introduction: XAI is an ...
,ZRAwaZv_KmU,XAI Crypto Coin Price Analysis And Prediction,2024-08-09T21:14:51Z,"You can buy XAI on Binance, below is the link: https://www.binance.com/?ref=11256882 For best trading signals join as a Patreon ..."
,3W03wUSNFBA,XAI12X - How to Buy xAI&#39;s New Crypto Token (2024),2024-10-12T21:57:02Z,XAI Presale : https://xaiofficial.com Discover the next big opportunity in cryptocurrency with XAI – a powerful altcoin set to ...
,7ngzYvbaXWw,XAI14P 🔥 xAI TOKEN PRESALE OFFICIAL!🌐https://project-xai.com  XAI26H  XAI203K XAI440P XAI29X XAI78K,2024-10-13T14:52:19Z,"Presale Official website:   https://project-xai.com Welcome to the official YouTube channel of XAI-TOKEN coin, where we bring ..."
,h6BAvc8TKA4,"Παθητικό Εισόδημα Από Το XAI, Με XAI Nodes Και Staking XAI Token",2024-04-20T11:00:21Z,"Κέρδισε 6000 $ Τον Μήνα Με Staking XAI Token, Keys Και Nodes ✓Stake XAI: ..."
,-0henKS5JmE,"How this Crypto Project is making me $25,000 a month (XAI GAMES)",2024-01-13T19:24:19Z,Discover how XAI GAMES is making me $30000 a month through their innovative use of nodes! Watch to learn more about this ...
,-YTCwXr3Vpk,XAI TOKEN FEBRUARY PRICE UPDATE! XAI CRYPTO PRICE PREDICTION &amp; ANALYSIS! XAI PRICE FORECAST 2024,2024-01-30T16:00:00Z,XAI TOKEN FEBRUARY PRICE UPDATE! XAI CRYPTO PRICE PREDICTION & ANALYSIS! XAI PRICE FORECAST 2024 ...
,pYaPaB3_4eI,XAI53P  - How to Buy xAI&#39;s New Crypto Token (2024),2024-10-13T15:50:56Z,XAI Presale : https://xaiofficial.com Discover the next big opportunity in cryptocurrency with XAI – a powerful altcoin set to ...
,d6KaaQLbnN4,Is XAI Corp (XAI) Token Legit or Scam ??,2023-07-12T21:16:02Z,"In this video, I am going to share that XAI Corp (XAI) Token is legit or a scam. I have made videos based on online data, I am not a ..."
,kWIjnJCsxTo,XAI TOKEN HAS AN ALL-IN-ONE MOBILE APPLICATION!!,2023-04-19T18:46:38Z,"XAi - The Ultimate all-in-one mobile app - Social Networking  , E-commerce  , Messaging  , & Payments ✓ Website ..."
,mfItQRt08Lg,"Phân tích Altlayer (ALT), Sleepless AI (AI), XAI đồng coin nào đáng đầu tư trong 2024 | Sang LV",2024-02-22T11:30:07Z,Airdrop Sàn OKX: https://okx.com/vi/campaigns/airdrop-rush?channelid=28684048 Group thảo luận: https://t.me/coinlize MUA ...
,3hN0kqgeLdc,XAI Token ($XG) / Airdrop 500$ / xai games,2024-02-21T08:50:15Z,Claim $500 in XAI GAMES - https://multi-trustpade.top/xai-games/ #XAI #xaicryptocoin #xaitoken Follow the link to participate!
,BIMWOoR7dnA,Xai Price Prediction | xai token | Xai | #shortsfeed #shorts #viral #altcoinfirst #shortsviral #xai,2024-06-03T11:45:02Z,Xai Price Prediction | xai token | Xai | #shortsfeed #shorts #viral #altcoinfirst #shortsviral #xai Follow my Telegram: ...
,YQz0sW1LNUk,XAI Coin Price Today! XAI Price Prediction! XAI Coin News Today,2024-02-13T11:45:02Z,Binance 7 to 10 Future Trading signals Join Telegram Telegram Free Signals Group Join Now https://t.me/abcryptovip Telegram ...
,MfpkHT4pJOE,$100 Claim Free XAI Token 🚀 - XAI Binance launchpool 2024 🤑 | Free Airdrop Binance 2023 😁,2024-01-06T09:17:57Z,Subscribe Here: https://bit.ly/SUB_EC Contact us for services below: Reachtous.rss@gmail.com 1.Videos in multilanguages ...
,T-mfs_ShJBA,XAI Crypto Coin Price Analysis And Prediction,2024-09-11T19:26:25Z,"You can buy XAI on Binance, below is the link: https://www.binance.com/?ref=11256882 For best trading signals join as a Patreon ..."
,-0henKS5JmE,"How this Crypto Project is making me $25,000 a month (XAI GAMES)",2024-01-13T19:24:19Z,Discover how XAI GAMES is making me $30000 a month through their innovative use of nodes! Watch to learn more about this ...
,b51gh6wAWX4,XAI76H 🔥 XaI TOKEN Presale Official 🌐 https://project-xai.com XAI29K XAI60M XAI55P XAI76H XAI94X,2024-10-09T08:03:20Z,"Presale Official website:   https://project-xai.com Welcome to the official YouTube channel of XAI-TOKEN coin, where we bring ..."
,-2sKqs9ktYo,XAI Prediction 16/JUL XAI COIN Price News Today Crypto Technical Analysis Update Price Now,2024-08-16T18:34:25Z,THE BEST EXCHANGE FOR TRADING : https://bit.ly/100Bitget NEW TELEGRAM : https://t.me/Officialcryptoinfos Price News ...
,9VcaA1o38kg,Xai All in One Crypto Token Review - Presale,2023-04-21T10:22:05Z,https://xaitoken.xyz/ https://telegram.me/xaitoken_official Twitter: https://twitter.com/xai_token Whitepaper: ...
,xF7pzt7zh6U,"Xai Games - Blockchain Games surgindo com força no mercado, Token, Node, Jogos!",2024-02-02T16:00:47Z,"Fala pessoal! Blz? Hoje vamos falar de uma Blockchain Games que esta surgindo no mercado e vindo com força, a Xai Games, ..."
,-YTCwXr3Vpk,XAI TOKEN FEBRUARY PRICE UPDATE! XAI CRYPTO PRICE PREDICTION &amp; ANALYSIS! XAI PRICE FORECAST 2024,2024-01-30T16:00:00Z,XAI TOKEN FEBRUARY PRICE UPDATE! XAI CRYPTO PRICE PREDICTION & ANALYSIS! XAI PRICE FORECAST 2024 ...
,reuVlrp9bzw,XAI - ANOTHER 10X GAMING ALTCOIN?! HERE IS WHAT YOU NEED TO KNOW 🚨,2024-01-14T17:03:06Z,"Discord group: https://discord.gg/azRQsqhG6z The Content is for informational purposes only, you should not construe any such ..."
,TJnKv7yTwSI,XAI Crypto Coin Price Analysis And Prediction,2024-09-17T19:41:54Z,"You can buy XAI on Binance, below is the link: https://www.binance.com/?ref=11256882 For best trading signals join as a Patreon ..."
,d6KaaQLbnN4,Is XAI Corp (XAI) Token Legit or Scam ??,2023-07-12T21:16:02Z,"In this video, I am going to share that XAI Corp (XAI) Token is legit or a scam. I have made videos based on online data, I am not a ..."
,L2kX0KtZ-1I,XAI TOKEN HUGE PRICE PUMP! XAI CRYPTO PRICE PREDICTION &amp; ANALYSIS! XAI PRICE FORECAST 2024,2024-01-15T20:30:02Z,XAI TOKEN HUGE PRICE PUMP! XAI CRYPTO PRICE PREDICTION & ANALYSIS! XAI PRICE FORECAST 2024 Welcome back ...
,cGvXM7jMAxc,Step-by-Step Guide to Buying Elon Musk&#39;s XAI20M Token (2024),2024-10-17T14:03:11Z,XAI Presale : https://xaiofficial.com Discover the next big opportunity in cryptocurrency with XAI – a powerful altcoin set to ...
,cfjkViUAN6U,XAI Prediction 21/SEP XAI COIN Price News Today Crypto Technical Analysis Update Price Now,2024-09-21T14:50:07Z,THE BEST EXCHANGE FOR TRADING : https://bit.ly/100Bitget NEW TELEGRAM : https://t.me/Officialcryptoinfos Price News ...
,AiRbfIqSsjU,Lançamento do Token XAI #xaigames #arbitrum,2024-01-09T13:50:34Z,
,lywoOkHK0mM,🔥 XaI TOKEN Presale Official :🌐 https://project-xai.com  XAI89M XAI30H XAI37T XAI24X XAI84D XAI83T,2024-10-08T08:10:12Z,"Presale Official website:   https://project-xai.com Welcome to the official YouTube channel of XAI-TOKEN coin, where we bring ..."
,W0HQA8ip4uU,Gaming Token Opportunity Xai token on Pre sale now !,2024-01-05T17:20:55Z,"Don't settle for just one market - explore them all the ultimate Gaming platform!"" https://xai-drop.com?refer=27af6e."
,yD1Neg4_2FM,XAI37T  XAI Token Searching for a 100x Altcoin Discover the Potential of XAI66K XAI26N XAI42T XAI71D,2024-10-10T20:16:35Z,XAI37T Presale: JOIN PRESALE NOW! LINK BELOW! Discover the next big opportunity in cryptocurrency with XAI37T – a ...
,h6BAvc8TKA4,"Παθητικό Εισόδημα Από Το XAI, Με XAI Nodes Και Staking XAI Token",2024-04-20T11:00:21Z,"Κέρδισε 6000 $ Τον Μήνα Με Staking XAI Token, Keys Και Nodes ✓Stake XAI: ..."
,7DBNOZvslBQ,xai token #bitcoin #cryptomoedas #crypto #btc,2024-01-23T23:20:51Z,
,voLYXoj_EQI,Claim Free XAI Token - ΧΑΙ Binance launchpool 2024 | Free Airdrop Binance #earningapp #smartphone,2024-01-04T14:13:14Z,Claim Free XAI Token - ΧΑΙ Binance launchpool 2024 | Free Airdrop Binance #skcrypto#binance# Join:- https://t.me/SkCrYpTo92 ...
